22173,METAL 4 HOOK HANGER FRENCH CHATEAU
62095B,
22853,CAT BOWL VINTAGE CREAM
44228,CANNABIS LEAF BEAD CURTAIN
90013A,MIDNIGHT BLUE VINTAGE EARRINGS
85114B,IVORY ENCHANTED FOREST PLACEMAT
84754,S/15 SILVER GLASS BAUBLES IN BAG
22577,WOODEN HEART CHRISTMAS SCANDINAVIAN
22531,MAGIC DRAWING SLATE CIRCUS PARADE  
22291,HANGING CHICK CREAM DECORATION
16161P,WRAP ENGLISH ROSE 
21908,CHOCOLATE THIS WAY METAL SIGN
21814,
21896,POTTING SHED TWINE
21623,VINTAGE UNION JACK MEMOBOARD
21945,STRAWBERRIES  DESIGN FLANNEL 
22945,CHRISTMAS METAL TAGS ASSORTED 
22776,"""CAKESTAND"
85194L,HANGING SPRING FLOWER EGG LARGE
20868,SILVER FABRIC MIRROR
90204,PAIR OF ENAMEL BUTTERFLY HAIRCLIP
20961,STRAWBERRY BATH SPONGE 
90199A,5 STRAND GLASS NECKLACE BLACK
72741,GRAND CHOCOLATECANDLE
20857,BLUE ROSE PATCH PURSE PINK BUTTERFL
90214P,"""LETTER """"P"""" BLING KEY RING"""
84270,
84596F,SMALL MARSHMALLOWS PINK BOWL
84569B,
22194,BLACK DINER WALL CLOCK
21579,LOLITA  DESIGN  COTTON TOTE BAG
20861,GOLD COSMETIC BAG PINK STAR
20663,QUEEN OF THE SKIES HOLIDAY PURSE 
84988,SET OF 72 PINK HEART PAPER DOILIES
22383,LUNCH BAG SUKI  DESIGN 
90050,CRACKED GLAZE NECKLACE IVORY
22754,SMALL RED BABUSHKA NOTEBOOK 
22101,MIRROR MOSAIC VOTIVE HOLDER
22155,STAR DECORATION RUSTIC
22197,SMALL POPCORN HOLDER
22441,GROW YOUR OWN BASIL IN ENAMEL MUG
90002D,FLOWER BURST SILVER RING CRYSTAL
21784,
22617,BAKING SET SPACEBOY DESIGN
21523,DOORMAT FANCY FONT HOME SWEET HOME
15056P,EDWARDIAN PARASOL PINK
84509C,SET OF 4 POLKADOT PLACEMATS 
22712,CARD DOLLY GIRL 
85049g,CHOCOLATE BOX RIBBONS 
20878,
22409,MONEY BOX BISCUITS DESIGN
84818,DANISH ROSE PHOTO FRAME
85006,SET 4 NURSERY DES ROUND BOXES
21725,SWEETIES  STICKERS
21819,GLITTER CHRISTMAS STAR 
21132,SILVER STANDING GNOME   
21821,GLITTER STAR GARLAND WITH BELLS 
22319,HAIRCLIPS FORTIES FABRIC ASSORTED
84559B,3D SHEET OF CAT STICKERS
90199B,5 STRAND GLASS NECKLACE AMETHYST
46000U,POLYESTER FILLER PAD 30CMx30CM
21175,GIN + TONIC DIET METAL SIGN
84898F,
22932,BAKING MOULD TOFFEE CUP  CHOCOLATE
20702,PINK PADDED MOBILE
16169P,WRAP GREEN RUSSIAN FOLKART 
85232B,SET OF 3 BABUSHKA STACKING TINS
85167B,BLACK GRAND BAROQUE PHOTO FRAME
84584,PINK GINGHAM CAT WITH SCARF
90138,WHITE/PINK MINI CRYSTALS NECKLACE
16168M,FUNKY MONKEY GIFT BAG MEDIUM
21710,FOLDING UMBRELLA PINKWHITE POLKADOT
21245,GREEN POLKADOT PLATE 
22925,BLUE GIANT GARDEN THERMOMETER
85018C,
35648,VINTAGE BEAD PINK PURSE 
21982,PACK OF 12 SUKI TISSUES 
21369,MIRRORED WALL ART SPLODGES
84828,JUNGLE POPSICLES ICE LOLLY HOLDERS
22867,HAND WARMER BIRD DESIGN
84843,WHITE SOAP RACK WITH 2 BOTTLES
21086,SET/6 RED SPOTTY PAPER CUPS
90042A,FRESHWATER PEARL BRACELET GOLD
22447,PIN CUSHION BABUSHKA BLUE
22697,GREEN REGENCY TEACUP AND SAUCER
72133,COLUMBIAN CANDLE RECTANGLE
22935,BAKING MOULD ROSE MILK CHOCOLATE
22937,BAKING MOULD CHOCOLATE CUP CAKES
22771,CLEAR DRAWER KNOB ACRYLIC EDWARDIAN
22067,CHOC TRUFFLE GOLD TRINKET POT 
21488,
35004C,SET OF 3 COLOURED  FLYING DUCKS
22434,BALLOON PUMP WITH 10 BALLOONS
90202A,PURPLE ENAMEL FLOWER HAIR TIE
21556,CERAMIC STRAWBERRY MONEY BOX
22834,HAND WARMER BABUSHKA DESIGN
47518f,ICON PLACEMAT POP ART ELVIS
84993A,75 GREEN PETIT FOUR CASES
47369A,PINK GREEN EMBROIDERY COSMETIC BAG
90198A,VINTAGE ROSE BEAD BRACELET RASPBERR
22453,MEASURING TAPE BABUSHKA BLUE
84226,HEN HOUSE W FAMILY IN BARN & NEST
21787,RAIN PONCHO RETROSPOT
85170D,SET/6 PINK BIRD T-LIGHT CANDLES
21576,LETS GO SHOPPING COTTON TOTE BAG
90132,LIGHT TOPAZ TEAL/AQUA COL NECKLACE
85055,FRENCH ENAMEL UTENSIL HOLDER
85032A,ROMANTIC IMAGES GIFT WRAP SET
22421,LIPSTICK PEN FUSCHIA
22707,WRAP MONSTER FUN 
84926E,FLOWERS TILE COASTER
21544,SKULLS  WATER TRANSFER TATTOOS 
79329,PINK FLOCK GLASS CANDLEHOLDER
84931A,PINK SCOTTIE DOG W FLOWER PATTERN
22311,OFFICE MUG WARMER BLACK+SILVER 
90155,RESIN NECKLACE W PASTEL BEADS
90000B,MIDNIGHT BLUE COPPER FLOWER NECKLAC
90038B,GLASS AND PAINTED BEADS BRACELET OL
22961,JAM MAKING SET PRINTED
22805,BLUE DRAWER KNOB ACRYLIC EDWARDIAN
21485,RETROSPOT HEART HOT WATER BOTTLE
22293,HANGING CHICK GREEN DECORATION
20758,ABSTRACT CIRCLES POCKET BOOK
85034C,3 ROSE MORRIS BOXED CANDLES
22826,LOVE SEAT ANTIQUE WHITE METAL
85023C,PINK LARGE JEWELED PHOTOFRAME
22626,BLACK KITCHEN SCALES
90092,BLUE CRYSTAL BOOT PHONE CHARM
21518,BANK ACCOUNT  GREETING  CARD 
22717,CARD DOG AND BALL 
22551,PLASTERS IN TIN SPACEBOY
84849B,FAIRY SOAP SOAP HOLDER
84507C,BLUE CIRCLES DESIGN MONKEY DOLL
20980,36 PENCILS TUBE POSY
21564,PINK  HEART SHAPE LOVE BUCKET 
22714,CARD BIRTHDAY COWBOY
22900, SET 2 TEA TOWELS I LOVE LONDON 
22830,
22562,MONSTERS STENCIL CRAFT
22952,60 CAKE CASES VINTAGE CHRISTMAS
22482,BLUE TEA TOWEL CLASSIC DESIGN
37467,
85130C,BEADED CRYSTAL HEART BLUE  LARGE
21040,
22813,PACK 3 BOXES BIRD PANNETONE 
85127,SMALL SQUARE CUT GLASS CANDLESTICK
20771,CHRYSANTHEMUM  JOURNAL
21746,SMALL RED RETROSPOT WINDMILL
35954,SMALL FOLKART STAR CHRISTMAS DEC
90129C,GREEN GLASS TASSLE BAG CHARM
22491,PACK OF 12 COLOURED PENCILS
22701,PINK DOG BOWL
21638,ASSORTED TUTTI FRUTTI NOTEBOOK
20698,LITTLE PINK MONSTER SOFT TOY
22219,LOVEBIRD HANGING DECORATION WHITE 
22260,FELT EGG COSY BLUE RABBIT 
22726,ALARM CLOCK BAKELIKE GREEN
84596L,BISCUITS SMALL BOWL LIGHT BLUE
22907,PACK OF 20 NAPKINS PANTRY DESIGN
47591D,
22785,SQUARECUSHION COVER PINK UNION FLAG
21131,GOLD STANDING GNOME
21824,PAINTED METAL STAR WITH HOLLY BELLS
84559a,3D SHEET OF DOG STICKERS
22457,NATURAL SLATE HEART CHALKBOARD 
85227,SET OF 6 3D KIT CARDS FOR KIDS
22904,CALENDAR PAPER CUT DESIGN
21286,RETROSPOT CANDLE  LARGE
22914,BLUE COAT RACK PARIS FASHION
22660,DOORMAT I LOVE LONDON
90179A,AMBER FINE BEAD NECKLACE W TASSEL
22050,PINK PAISLEY ROSE GIFT WRAP
82486,WOOD S/3 CABINET ANT WHITE FINISH
22747,POPPY'S PLAYHOUSE BATHROOM
85131A,BEADED PEARL HEART WHITE ON STICK
22521,CHILDS GARDEN TROWEL PINK
72815,3 WICK CHRISTMAS BRIAR CANDLE 
22550,HOLIDAY FUN LUDO
85039C,S/4 BLACK MINI ROSE CANDLE IN BOWL
21365,MIRRORED WALL ART STARS
85020,ROUND PINK HEART MIRROR
22245,"""HOOK"
90143,SILVER BRACELET W PASTEL FLOWER
85014b,RED RETROSPOT UMBRELLA
21407,BROWN CHECK CAT DOORSTOP 
21080,SET/20 RED RETROSPOT PAPER NAPKINS 
22713,CARD I LOVE LONDON 
46776B,WOVEN BERRIES CUSHION COVER 
21745,GAOLERS KEYS DECORATIVE GARDEN 
84971S,SMALL HEART FLOWERS HOOK 
20892,SET/3 TALL GLASS CANDLE HOLDER PINK
21632,
22505,MEMO BOARD COTTAGE DESIGN
22910,PAPER CHAIN KIT VINTAGE CHRISTMAS
21172,
22432,WATERING CAN PINK BUNNY
21244,BLUE POLKADOT PLATE 
22638,SET OF 4 NAPKIN CHARMS CROWNS 
22621,TRADITIONAL KNITTING NANCY
84688,
79192A,RETRO PLASTIC 70'S TRAY
20954,*USB Office Mirror Ball
22985,"""WRAP"
90086,CRYSTAL FROG PHONE CHARM
21705,BAG 500g SWIRLY MARBLES
84880,WHITE WIRE EGG HOLDER
22282,12 EGG HOUSE PAINTED WOOD
22405,MONEY BOX POCKET MONEY DESIGN
22891,TEA FOR ONE POLKADOT
21402,RED  EGG  SPOON
22565,FELTCRAFT HAIRBANDS PINK AND WHITE 
20856,DENIM PATCH PURSE PINK BUTTERFLY
22365,DOORMAT RESPECTABLE HOUSE
85185B,PINK HORSE SOCK PUPPET
90094,NECKLACE+BRACELET SET FRUIT SALAD 
22363,GLASS JAR MARMALADE 
85169A,IVORY LOVE BIRD CANDLE
46000P,POLYESTER FILLER PAD 65CMx65CM
84925F,PSYCHEDELIC WALL THERMOMETER
85118,
21937,STRAWBERRY   PICNIC BAG
84800S,SMALL WHITE/PINK ROSE ART FLOWER
22123,PING MICROWAVE APRON
21174,POTTERING IN THE SHED METAL SIGN
72127,COLUMBIAN CANDLE ROUND 
20719,WOODLAND CHARLOTTE BAG
85230G,ORANGE VOTIVE CANDLE
84539,KNITTED RABBIT DOLL 
21895,POTTING SHED SOW 'N' GROW SET
84631,FRUIT TREE AND BIRDS WALL PLAQUE
20764,ABSTRACT CIRCLES SKETCHBOOK 
20671,BLUE TEATIME PRINT BOWL 
84875B,GREEN SQUARE COMPACT MIRROR
22289,HANGING METAL CHICKEN DECORATION
21361,LOVE LARGE WOOD LETTERS 
20871,OPULENT VELVET SET/3 CANDLES
20734,SILVER MINI TAPE MEASURE 
22946,WOODEN ADVENT CALENDAR CREAM
22078,RIBBON REEL LACE DESIGN 
22921,HERB MARKER CHIVES 
23230,WRAP ALPHABET DESIGN
78124,MAGAZINE RACK GEBRA ASSORTED 
84881,BLUE WIRE SPIRAL CANDLE HOLDER
21793,CLASSIC FRENCH STYLE BASKET BROWN
22475,SKULL DESIGN TV DINNER TRAY
20696,FLORAL SOFT CAR TOY
90136,PALE PINK/AMETHYST STONE NECKLACE
84744,S/6 SEW ON CROCHET FLOWERS
84663A,GRASS HOPPER WOODEN WALL CLOCK 
90054,CRACKED GLAZE EARRINGS RED
17091J,VANILLA INCENSE IN TIN
20960,WATERMELON BATH SPONGE
21743,
35597A,DUSTY PINK CHRISTMAS TREE 30CM
85141,JARDIN ETCHED GLASS FRUITBOWL
37495,FAIRY CAKE BIRTHDAY CANDLE SET
21534,DAIRY MAID LARGE MILK JUG
84970l,SINGLE HEART ZINC T-LIGHT HOLDER
22430,ENAMEL WATERING CAN CREAM
22752,SET 7 BABUSHKA NESTING BOXES
72799E,IVORY PILLAR CANDLE SILVER FLOCK
72780,BLACK SILOUETTE CANDLE PLATE
85136B,BLUE SHARK HELICOPTER
22153,ANGEL DECORATION STARS ON DRESS
35607A,PINK FLUFFY CHRISTMAS DECORATION
84795B,SUNSET CHECK HAMMOCK
90053,CRACKED GLAZE EARRINGS IVORY
22130,PARTY CONE CHRISTMAS DECORATION 
85096,HILDA CANDY SPOT RABBIT
90130D,RED STONE/CRYSTAL EARRINGS
72800D,4 BLUE DINNER CANDLES SILVER FLOCK
21371,MIRRORED WALL ART POPPIES
21641,ASSORTED TUTTI FRUTTI KEYRING BALL
22651,GENTLEMAN SHIRT REPAIR KIT 
90201D,GREEN ENAMEL FLOWER RING
16054,POPART RECT PENCIL SHARPENER ASST
22803,IVORY EMBROIDERED QUILT 
84598,BOYS ALPHABET IRON ON PATCHES
48111,DOORMAT 3 SMILEY CATS
22501,
21121,SET/10 RED POLKADOT PARTY CANDLES
22313,OFFICE MUG WARMER PINK
82599,?
90161C,ANT COPPER LIME BOUDICCA BRACELET
22703,PINK CAT BOWL
85129D,BEADED CRYSTAL HEART PINK SMALL
84546,
22610,PENS ASSORTED FUNNY FACE
22086,PAPER CHAIN KIT 50'S CHRISTMAS 
90184C,BLACK CHUNKY BEAD BRACELET W STRAP
84913A,SOFT PINK ROSE TOWEL 
84078A,SET/4 WHITE RETRO STORAGE CUBES 
21472,LADYBIRD + BEE RAFFIA FOOD COVER
22152,PLACE SETTING WHITE STAR
84950,ASSORTED COLOUR T-LIGHT HOLDER
22184,CAKE STAND VICTORIAN FILIGREE LARGE
72760B,VINTAGE CREAM 3 BASKET CAKE STAND
90002D,
21932,SCANDINAVIAN PAISLEY PICNIC BAG
51014L,"""FEATHER PEN"
21447,12 IVORY ROSE PEG PLACE SETTINGS
37461,
84616,SILVER ROCCOCO CHANDELIER
21129,SILVER FISHING GNOME 
22796,PHOTO FRAME 3 CLASSIC HANGING
20733,GOLD MINI TAPE MEASURE 
22305,COFFEE MUG PINK PAISLEY DESIGN
21258,VICTORIAN SEWING BOX LARGE
22683,FRENCH BLUE METAL DOOR SIGN 8
20717,STRAWBERRY SHOPPER BAG
22877,NUMBER TILE COTTAGE GARDEN 9
22795,SWEETHEART RECIPE BOOK STAND
22568,FELTCRAFT CUSHION OWL
85014A,BLACK/BLUE POLKADOT UMBRELLA
17012A,ORIGAMI VANILLA INCENSE/CANDLE SET 
22060,LARGE CAKE STAND HANGING HEARTS
22704,WRAP RED APPLES 
21520,BOOZE & WOMEN GREETING CARD 
21946,PARTY TIME DESIGN FLANNEL
84751B,BLACK MEDIUM GLASS CAKE STAND
23233,WRAP POPPIES  DESIGN
22425,ENAMEL COLANDER CREAM
21026,SPACE OWL
20973,12 PENCIL SMALL TUBE WOODLAND
90126A,PINK BERTIE MOBILE PHONE CHARM
90214A,"""LETTER """"A"""" BLING KEY RING"""
21497,FANCY FONTS BIRTHDAY WRAP
21934,SKULL SHOULDER BAG
84378,SET OF 3 HEART COOKIE CUTTERS
72232,FENG SHUI PILLAR CANDLE
82001S,VINYL RECORD FRAME SILVER
22051,BLUE SCANDINAVIAN PAISLEY WRAP
85179A,GREEN BITTY LIGHT CHAIN
21616,4 PEAR BOTANICAL DINNER CANDLES
20982,12 PENCILS TALL TUBE SKULLS
85178,VICTORIAN SEWING KIT
21469,POLKA DOT RAFFIA FOOD COVER
82580,BATHROOM METAL SIGN
21226,POCKET MIRROR WOODLAND
22866,
22797,CHEST OF DRAWERS GINGHAM HEART 
37509,
71053,WHITE METAL LANTERN
22937,BAKING MOULD CUPCAKE CHOCOLATE
90085,CRYSTAL STILETTO PHONE CHARM
48184,DOORMAT ENGLISH ROSE 
21640,ASSORTED TUTTI FRUTTI  FOB NOTEBOOK
20869,GOLD FABRIC MIRROR
22049,WRAP CHRISTMAS SCREEN PRINT
22918,HERB MARKER PARSLEY
22132,RED LOVE HEART SHAPE CUP
84352,SILVER CHRISTMAS TREE BAUBLE STAND 
21038,SET/4 MODERN VINTAGE COTTON NAPKINS
22800,ANTIQUE TALL SWIRLGLASS TRINKET POT
82011B,BATHROOM SCALES RUBBER DUCKS
21724,PANDA AND BUNNIES STICKER SHEET
22588,CARD HOLDER GINGHAM HEART
20751,FUNKY WASHING UP GLOVES ASSORTED
22221,CAKE STAND LOVEBIRD 2 TIER PINK
21359,RELAX LARGE WOOD LETTERS
72807a,SET/3 ROSE CANDLE IN JEWELLED BOX
22372,AIRLINE BAG VINTAGE WORLD CHAMPION 
21189,WHITE HONEYCOMB PAPER GARLAND 
21160,KEEP OUT GIRLS DOOR HANGER 
37468,HARDMAN MUG 3 ASSORTED
84745A,PINK HANGING GINGHAM EASTER HEN
21231,SWEETHEART CERAMIC TRINKET BOX
21275,
90013B,BLACK VINTAGE EARRINGS
47586A,PINK FAIRY CAKE CUSHION COVER
22932,BAKING MOULD TOFFEE CUP CHOCOLATE
20664,TROPICAL HOLIDAY PURSE 
22169,FAMILY ALBUM WHITE PICTURE FRAME
22093,MOTORING TISSUE BOX
21258,?
21115,ROSE CARAVAN DOORSTOP
22524,CHILDRENS GARDEN GLOVES BLUE
21034,REX CASH+CARRY JUMBO SHOPPER
22893,MINI CAKE STAND T-LIGHT HOLDER
90168,2 DAISIES HAIR COMB
21656,RIDGED GLASS POSY VASE 
84741C,CITRUS GARLAND FELT FLOWERS 
90035A,"""PEARL & SHELL 42""""NECKL. GREEN"""
22971,QUEENS GUARD COFFEE MUG
21986,PACK OF 12 PINK POLKADOT TISSUES
22927,GREEN GIANT GARDEN THERMOMETER
22857,ASSORTED EASTER GIFT TAGS
22085,PAPER CHAIN KIT SKULLS 
21211,SET OF 72 SKULL PAPER  DOILIES
84725,FREESTYLE CANVAS ART PICTURE
21868,POTTING SHED TEA MUG
84499,BLACK FLOWER CANDLE PLATE
35443,RASTA IN BATH W SPLIFF ASHTRAY
37343,POLKADOT MUG PINK 
21161,KEEP OUT BOYS DOOR HANGER 
22677,FRENCH BLUE METAL DOOR SIGN 2
22755,SMALL PURPLE BABUSHKA NOTEBOOK 
84978,HANGING HEART JAR T-LIGHT HOLDER
85093,CANDY SPOT EGG WARMER HARE
90162D,ANT SILVER PURPLE BOUDICCA RING
84913B,MINT GREEN ROSE TOWEL
84519A,TOMATO CHARLIE+LOLA COASTER SET
20661,BLUE POLKADOT PURSE 
21012,ANTIQUE ALL GLASS CANDLESTICK
84666,SQUARE CHERRY BLOSSOM CABINET
84661B,BLACK SQUARE TABLE CLOCK
21733,RED HANGING HEART T-LIGHT HOLDER
22112,CHOCOLATE HOT WATER BOTTLE
22851,SET 20 NAPKINS FAIRY CAKES DESIGN 
35271S,GOLD PRINT PAPER BAG
22249,DECORATION WHITE CHICK MAGIC GARDEN
21832,CHOCOLATE CALCULATOR
21902,"""KEY FOB "
22200,FRYING PAN PINK POLKADOT
20830,SILVER PHOTO FRAME
90160A,PURPLE BOUDICCA LARGE BRACELET
21217,RED RETROSPOT ROUND CAKE TINS
22911,PAPER CHAIN KIT LONDON
47594A,CAROUSEL DESIGN WASHBAG
82567,"""AIRLINE LOUNGE"
22732,3D VINTAGE CHRISTMAS STICKERS 
90202C,GREEN ENAMEL FLOWER HAIR TIE
20755,BLUE PAISLEY POCKET BOOK
22079,RIBBON REEL HEARTS DESIGN 
90177B,DROP DIAMANTE EARRINGS BLACK DIAMON
21594,Dr. Jam's Arouzer Stress Ball
21944,KITTENS DESIGN FLANNEL
21731,RED TOADSTOOL LED NIGHT LIGHT
85206B,PINK FELT EASTER EGG BASKET
35961,FOLKART ZINC HEART CHRISTMAS DEC
22517,CHILDS GARDEN RAKE PINK
48187,DOORMAT NEW ENGLAND
90170,DAISY HAIR BAND
22410,MONEY BOX HOUSEKEEPING DESIGN
21777,
22810,SET OF 6 T-LIGHTS SNOWMEN
20967,GREY FLORAL FELTCRAFT SHOULDER BAG
84508C,BLUE CIRCLES DESIGN TEDDY
17084J,LOVE POTION MASALA INCENSE
85230E,STRAWBRY SCENTED VOTIVE CANDLE
22888,NUMBER TILE VINTAGE FONT 9 
22390,PAPERWEIGHT CHILDHOOD MEMORIES
22591,
20936,FORKED CACTUS CANDLE
21895,
21062,PARTY INVITES SPACEMAN
20699,MOUSEY LONG LEGS SOFT TOY
90037B,TINY CRYSTAL BRACELET GREEN
21721,CANDY SHOP  STICKER SHEET
21486,PINK HEART DOTS HOT WATER BOTTLE
90076,MONTANA DIAMOND CLUSTER EARRINGS
22898,CHILDRENS APRON APPLES DESIGN
22193,RED DINER WALL CLOCK
22905,CALENDAR IN SEASON DESIGN
18097A,PINK TALL PORCELAIN T-LIGHT HOLDER 
90118,PINK DAISY BAG CHARM
85188B,PINK METAL SWINGING BUNNY
21114,LAVENDER SCENTED FABRIC HEART
21808,"""CHRISTMAS GARLAND STARS"
79051A,SMOKEY GREY COLOUR D.O.F. GLASS
20970,PINK FLORAL FELTCRAFT SHOULDER BAG
22353,LUNCH BOX WITH CUTLERY FAIRY CAKES 
79320,FLAMINGO LIGHTS
90120C,GREEN MURANO TWIST BRACELET
90200E,GREEN SWEETHEART BRACELET
20727,LUNCH BAG  BLACK SKULL.
21212,PACK OF 72 RETROSPOT CAKE CASES
90214M,"""LETTER """"M"""" BLING KEY RING"""
90027A,GLASS BEAD HOOP EARRINGS BLACK
22449,SILK PURSE BABUSHKA PINK
90023,FILIGREE DIAMANTE EARRINGS
21894,POTTING SHED SEED ENVELOPES
16012,FOOD/DRINK SPONGE STICKERS
22204,MILK PAN BLUE POLKADOT
20866,BLUE ROSE FABRIC MIRROR
21197,MULTICOLOUR  CONFETTI IN TUBE
22654,DELUXE SEWING KIT 
21209,MULTICOLOUR HONEYCOMB FAN
21163,DO NOT TOUCH MY STUFF DOOR HANGER 
84563A,PINK & WHITE BREAKFAST TRAY
21498,RED RETROSPOT WRAP 
85124C,GREEN JUICY FRUIT PHOTO FRAME
22477,WATERING CAN GARDEN MARKER
16202E,BLACK PHOTO ALBUM 
47566b,TEA TIME PARTY BUNTING
20665,RED RETROSPOT PURSE 
22679,FRENCH BLUE METAL DOOR SIGN 4
90042B,
17090A,LAVENDER INCENSE 40 CONES IN TIN
21642,ASSORTED TUTTI FRUTTI PEN
22940,FELTCRAFT CHRISTMAS FAIRY
37446,MINI CAKE STAND WITH HANGING CAKES
20619,TROPICAL PASSPORT COVER 
22454,
22423,faulty
22623,BOX OF VINTAGE JIGSAW BLOCKS 
84569D,PACK 6 HEART/ICE-CREAM PATCHES
85044,
21784,SHOE SHINE BOX 
22163,HEART STRING MEMO HOLDER HANGING
21985,PACK OF 12 HEARTS DESIGN TISSUES 
22386,JUMBO BAG PINK POLKADOT
21877,HOME SWEET HOME MUG
21028,NINJA RABBIT BLACK
90144,SILVER DROP EARRINGS WITH FLOWER
21427,SKULLS STORAGE BOX SMALL
22668,PINK BABY BUNTING
22385,JUMBO BAG SPACEBOY DESIGN
22865,
15058B,PINK POLKADOT GARDEN PARASOL
90178A,AMBER CHUNKY GLASS+BEAD NECKLACE
84806A,PINK CANDYSTUFT ARTIFICIAL FLOWER
84997C,BLUE 3 PIECE POLKADOT CUTLERY SET
17013D,ORIGAMI ROSE INCENSE IN TUBE
21394,RED POLKADOT BEAKER 
21906,PHARMACIE FIRST AID TIN
22323,
82482,WOODEN PICTURE FRAME WHITE FINISH
22635,CHILDS BREAKFAST SET DOLLY GIRL 
90211B,JET BLACK LAS VEGAS NECKLACE 45CM
20785,FUSCHIA RETRO BAR STOOL
21460,GREEN EASTER EGG HUNT START POST
22617,"""mouldy"
22150,3 STRIPEY MICE FELTCRAFT
90119,METALIC LEAVES BAG CHARMS
85230F,JASMINE VOTIVE CANDLE
90197B,BLACK GLASS BRACELET W HEART CHARMS
21804,WHITE CHRISTMAS GARLAND STARS TREES
84569B,PACK 3 FIRE ENGINE/CAR PATCHES
21754,HOME BUILDING BLOCK WORD
20878,SET/9 CHRISTMAS T-LIGHTS SCENTED 
22355,CHARLOTTE BAG SUKI DESIGN
90096,NECKLACE+BRACELET SET BLUE BLOSSOM
90214W,"""LETTER """"W"""" BLING KEY RING"""
20910,VINTAGE PHOTO ALBUM PARIS DAYS
21873,IF YOU CAN'T STAND THE HEAT MUG
17090D,VANILLA INCENSE 40 CONES IN TIN
20795,LARGE BLUE PROVENCAL CERAMIC BALL
21844,RED RETROSPOT MUG
21207,SKULL AND CROSSBONES  GARLAND 
22933,BAKING MOULD EASTER EGG MILK CHOC
47590B,PINK HAPPY BIRTHDAY BUNTING
51020B,STRIPY DESIGN SHOWER CAP
22840,ROUND CAKE TIN VINTAGE RED
22310,IVORY KNITTED MUG COSY 
84375,SET OF 20 KIDS COOKIE CUTTERS
79000,MOROCCAN TEA GLASS
21557,SET OF 6 FUNKY BEAKERS
22186,RED STAR CARD HOLDER
85049F,BABY BOOM RIBBONS 
21458,2 PICTURE BOOK EGGS EASTER BUNNY
16011,ANIMAL STICKERS
90012A,MIDNIGHT BLUE DROP CRYSTAL NECKLACE
90192,JADE DROP EARRINGS W FILIGREE
90130B,TURQ STONE/CRYSTAL EARRINGS
22742,MAKE YOUR OWN PLAYTIME CARD KIT
84597C,RETRO PINK BALL ASHTRAY 
22692,DOORMAT WELCOME TO OUR HOME
22446,PIN CUSHION BABUSHKA PINK
22070,SMALL RED RETROSPOT MUG IN BOX 
21216,"""SET 3 RETROSPOT TEA"
37475,SET/4 COLOURFUL MIXING BOWLS
84534B,FAIRY CAKE NOTEBOOK A5 SIZE
37489A,YELLOW/PINK FLOWER DESIGN BIG MUG
84849D,HOT BATHS SOAP HOLDER
84921,CREAM AND PINK FLOWERS PONY 
90122C,TURQUOISE CRYSTAL+GLASS BRACELET
22773,GREEN DRAWER KNOB ACRYLIC EDWARDIAN
22198,LARGE POPCORN HOLDER 
21292,SMALL STRIPES CHOCOLATE GIFT BAG 
21181,PLEASE ONE PERSON METAL SIGN
21781,MA CAMPAGNE CUTLERY BOX
21693,SMALL HAMMERED SILVER CANDLEPOT 
18098C,
35810A,ENAMEL PINK COFFEE CONTAINER
37370,RETRO COFFEE MUGS ASSORTED
22782,SET 3 WICKER STORAGE BASKETS 
22734,SET OF 6 RIBBONS VINTAGE CHRISTMAS
22955,36 FOIL STAR CAKE CASES 
90022,EDWARDIAN DROP EARRINGS JET BLACK
17011A,
POST,POSTAGE
22646,CERAMIC STRAWBERRY CAKE MONEY BANK
22837,Found
22111,SCOTTIE DOG HOT WATER BOTTLE
20782,CAMOUFLAGE EAR MUFF HEADPHONES
22537,MAGIC DRAWING SLATE DINOSAUR
85136A,YELLOW SHARK HELICOPTER
21201,TROPICAL  HONEYCOMB PAPER GARLAND 
84497,
21587,COSY HOUR GIANT TUBE MATCHES
47594B,SCOTTIES DESIGN WASHBAG
22501,reverse 21/5/10 adjustment
20835,FRENCH LATTICE CUSHION COVER 
21807,WHITE CHRISTMAS STAR DECORATION
21327,SKULLS WRITING SET 
35916C,PINK FELT HANGING HEART W FLOWER
16045,POPART WOODEN PENCILS ASST
90039C,FIRE POLISHED GLASS BRACELET BLACK
20886,BOX OF 9 PEBBLE CANDLES
21698,MOCK LOBSTER FRIDGE MAGNET
22254,FELT TOADSTOOL LARGE
21495,SKULLS AND CROSSBONES WRAP
22322,BIRD DECORATION GREEN POLKADOT
gift_0001_30,Dotcomgiftshop Gift Voucher £30.00
21761,WOOD AND GLASS MEDICINE CABINET
22230,JIGSAW TREE WITH WATERING CAN
90027D,GLASS BEAD HOOP EARRINGS AMETHYST
21397,BLUE POLKADOT EGG CUP 
84625C,BLUE NEW BAROQUE CANDLESTICK CANDLE
70007,HI TEC ALPINE HAND WARMER
90089,PINK CRYSTAL SKULL PHONE CHARM
22119,PEACE WOODEN BLOCK LETTERS
21243,PINK  POLKADOT PLATE 
47556B,
84033,FLAG OF ST GEORGE 
85163A,WHITE BAROQUE WALL CLOCK 
84709B,PINK OVAL JEWELLED MIRROR
90072,RUBY DROP CHANDELIER EARRINGS
90055,CRACKED GLAZE EARRINGS BROWN
22770,MIRROR CORNICE
22312,OFFICE MUG WARMER POLKADOT
40003,WHITE BAMBOO RIBS LAMPSHADE
21100,CHARLIE AND LOLA CHARLOTTE BAG
85185D,FROG SOCK PUPPET
85214,TUB 24 PINK FLOWER PEGS
90200A,PURPLE SWEETHEART BRACELET
22533,MAGIC DRAWING SLATE BAKE A CAKE 
22563,HAPPY STENCIL CRAFT
85172,HYACINTH BULB T-LIGHT CANDLES
85035b,CHOCOLATE 3 WICK MORRIS BOX CANDLE
21462,"""NURSERY A"
21264,WHITE GOOSE FEATHER TREE 60CM 
22158,
90211A,DIAMOND LAS VEGAS NECKLACE 45CM
22408,MONEY BOX CONFECTIONERY DESIGN
22496,SET OF 2 ROUND TINS DUTCH CHEESE
90206C,CRYSTAL DIAMANTE STAR BROOCH
90134,OLD ROSE COMBO BEAD NECKLACE
84927F,PSYCHEDELIC TILE HOOK
21468,BUTTERFLY CROCHET FOOD COVER
72369A,PINK CLEAR GLASS CANDLE PLATE
22091,EMPIRE TISSUE BOX
90214G,"""LETTER """"G"""" BLING KEY RING"""
84912A,PINK ROSE WASHBAG
22560,TRADITIONAL MODELLING CLAY
37489D,PINK/GREEN FLOWER DESIGN BIG MUG
21617,4 LILY  BOTANICAL DINNER CANDLES
22075,6 RIBBONS ELEGANT CHRISTMAS 
22148,EASTER CRAFT 4 CHICKS 
21376,LARGE  TALL CAMPHOR WOOD TOADSTOOL 
21110,LARGE CAKE TOWEL PINK SPOTS
85103,SILVER T-LIGHT SETTING
22988,SOLDIERS EGG CUP 
17012F,ORIGAMI SANDLEWOOD INCENSE/CAND SET
90152A,SILVER/NAT SHELL NECKLACE W PENDANT
22431,WATERING CAN BLUE ELEPHANT
48173c,DOORMAT BLACK FLOCK 
22170,PICTURE FRAME WOOD TRIPLE PORTRAIT
20984,12 PENCILS TALL TUBE POSY
22121,NOEL WOODEN BLOCK LETTERS 
90122A,PINK CRYSTAL+GLASS BRACELET
47570B,TEA TIME TABLE CLOTH
20777,CHRYSANTHEMUM NOTEBOOK
22281,EASTER TREE YELLOW BIRDS
90214T,"""LETTER """"T"""" BLING KEY RING"""
22833,HALL CABINET WITH 3 DRAWERS
22502,PICNIC BASKET WICKER SMALL
48173C,DOORMAT BLACK FLOCK 
22145,
22510,GINGHAM BABUSHKA DOORSTOP
22749,FELTCRAFT PRINCESS CHARLOTTE DOLL
22139,RETROSPOT TEA SET CERAMIC 11 PC 
21507,"""ELEPHANT"
21984,PACK OF 12 PINK PAISLEY TISSUES 
22725,ALARM CLOCK BAKELIKE CHOCOLATE
84881,
22632,HAND WARMER RED POLKA DOT
22558,CLOTHES PEGS RETROSPOT PACK 24 
21538,DAIRY MAID  PUDDING BOWL
21901,"""KEY FOB "
22339,CHRISTMAS TREE PAINTED ZINC 
84575A,PINK DOG CANNISTER
20831,GOLD PHOTO FRAME
75131,METAL TUBE CHIME ON BAMBOO
22351,Given away
22227,HANGING HEART MIRROR DECORATION 
47590A,BLUE HAPPY BIRTHDAY BUNTING
21386,IVORY HANGING DECORATION  EGG
47556B,TEA TIME TEA TOWELS 
22722,SET OF 6 SPICE TINS PANTRY DESIGN
21657,MILK BOTTLE WITH GLASS STOPPER 
82578,KITCHEN METAL SIGN
21064,BOOM BOX SPEAKER BOYS
21358,TOAST ITS - HAPPY BIRTHDAY
21826,EIGHT PIECE DINOSAUR SET
84817,DANISH ROSE DECORATIVE PLATE
22044,CHRISTMAS CARD STACK OF PRESENTS
35400,WOODEN BOX ADVENT CALENDAR 
21284,RETROSPOT CANDLE  SMALL
20725,LUNCH BAG RED RETROSPOT
40016,CHINESE DRAGON PAPER LANTERNS
84613C,BLUE NEW BAROQUE FLOCK CANDLESTICK
22277,COSMETIC BAG VINTAGE ROSE PAISLEY
22487,WHITE WOOD GARDEN PLANT LADDER
84952A,CLEAR LOVE BIRD T-LIGHT HOLDER
90062,CARNIVAL BRACELET
22147,FELTCRAFT BUTTERFLY HEARTS
21134,
90125B,AQUA BERTIE GLASS BEAD BAG CHARM
22760,"""TRAY"
79337,BLUE FLOCK GLASS CANDLEHOLDER
16237,SLEEPING CAT ERASERS
22959,WRAP CHRISTMAS VILLAGE
21040,MODERN VINTAGE COTTON SHOPPING BAG
21035,SET/2 RED RETROSPOT TEA TOWELS 
72128,COLUMBIAN CANDLE ROUND
21206,STRAWBERRY HONEYCOMB  GARLAND 
22133,PINK LOVE HEART SHAPE CUP
22671,FRENCH LAUNDRY SIGN BLUE METAL
22202,MILK PAN PINK POLKADOT
47469,ASSORTED SHAPES PHOTO CLIP SILVER 
21428,SET3 BOOK BOX GREEN GINGHAM FLOWER 
22468,BABUSHKA LIGHTS STRING OF 10
22522,CHILDS GARDEN FORK BLUE 
20658,RED RETROSPOT LUGGAGE TAG
21836,
22829,SWEETHEART WIRE WALL TIDY
90198B,VINTAGE ROSE BEAD BRACELET BLACK
22819,"""BIRTHDAY CARD"
21757,LIGHTHOUSE PRINTED METAL SIGN
21377,SMALL CAMPHOR WOOD FIELD  MUSHROOM
22930,BAKING MOULD HEART MILK CHOCOLATE
21925,UNION STRIPE CUSHION COVER 
21463,MIRRORED DISCO BALL 
21210,SET OF 72 RETROSPOT PAPER  DOILIES
21789,KIDS RAIN MAC PINK
72800C,4 PINK DINNER CANDLE SILVER FLOCK
21246,RED RETROSPOT BIG BOWL
84251B,"""GREETING CARD"
79323B,BLACK CHERRY LIGHTS
22709,WRAP WEDDING DAY
47367B,PAIR PADDED HANGERS PINK CHECK
22107,PIZZA PLATE IN BOX
21587,
90003C,MIDNIGHT BLUE PAIR HEART HAIR SLIDE
21717,EASTER TIN BUCKET
21120,*Boombox Ipod Classic
84563B,BLUE & WHITE BREAKFAST TRAY
22295,HEART FILIGREE DOVE LARGE
22689,DOORMAT MERRY CHRISTMAS RED 
21095,SET/6 POSIES PAPER PLATES
16169M,WRAP DAISY CARPET 
37467,PIG MUG IN TWO COLOUR DESIGNS
21716,BOYS VINTAGE TIN SEASIDE BUCKET
84461,12 PINK HEN+CHICKS IN BASKET
21592,RETROSPOT CIGAR BOX MATCHES 
22553,PLASTERS IN TIN SKULLS
72038P,damages
79151B,"""SILICON CUBE 25W"
17109D,FLOWER FAIRY INCENSE BOUQUET
71270,PHOTO CLIP LINE
84051,ASS COLOUR GLOWING TIARAS
22052,VINTAGE CARAVAN GIFT WRAP
22672,FRENCH BATHROOM SIGN BLUE METAL
21615,4 LAVENDER BOTANICAL DINNER CANDLES
72818,CHRISTMAS DECOUPAGE CANDLE
21651,HANGING GLASS ETCHED TEALIGHT
84750B,BLACK SMALL GLASS CAKE STAND
90133,TEAL/FUSCHIA COL BEAD NECKLACE
22210,WOOD STAMP SET BEST WISHES
21481,FAWN BLUE HOT WATER BOTTLE
71406C,BLACK ORANGE SQUEEZER
22155,
20756,GREEN FERN POCKET BOOK
21580,RABBIT  DESIGN  COTTON TOTE BAG
22966,GINGERBREAD MAN COOKIE CUTTER
21977,PACK OF 60 PINK PAISLEY CAKE CASES
21157,RED RETROSPOT WASHBAG
