35095A,BLUE VICTORIAN FABRIC OVAL BOX
21846,PINK DIAMANTE PEN IN GIFT BOX
90030B,RED KUKUI COCONUT SEED NECKLACE
21818,GLITTER CHRISTMAS HEART 
21320,GLASS CHALICE GREEN  LARGE 
22343,PARTY PIZZA DISH RED RETROSPOT
22499,WOODEN UNION JACK BUNTING
21588,RETROSPOT GIANT TUBE MATCHES
90078,PINK/WHITE GLASS DEMI CHOKER
22595,CHRISTMAS GINGHAM HEART
21030,SPACE CADET RED
90093,CLEAR CRYSTAL STAR PHONE CHARM
84796B,BLUE SAVANNAH PICNIC HAMPER FOR 2
48129,DOORMAT TOPIARY
20767,BLUE PAISLEY JOURNAL 
22852,DOG BOWL VINTAGE CREAM
21591,COSY HOUR CIGAR BOX MATCHES 
90141D,ROSE PENDANT TRIPLE SHELL NECKLACE
84920,PINK FLOWER FABRIC PONY
22338,STAR DECORATION PAINTED ZINC 
21936,RED RETROSPOT PICNIC BAG
21791,VINTAGE HEADS AND TAILS CARD GAME 
21158,MOODY GIRL DOOR HANGER 
21653,
85059,FRENCH ENAMEL WATER BASIN
22428,ENAMEL FIRE BUCKET CREAM
72134,COLUMBIAN  CUBE CANDLE 
20979,36 PENCILS TUBE RED RETROSPOT
82551,LAUNDRY 15C METAL SIGN
84760S,SMALL HANGING GLASS+ZINC LANTERN
22178,VICTORIAN GLASS HANGING T-LIGHT
47580,TEA TIME DES TEA COSY
90179C,BLACK FINE BEAD NECKLACE W TASSEL
22723,SET OF 6 HERB TINS SKETCHBOOK
21926,RED/CREAM STRIPE CUSHION COVER 
22956,36 FOIL HEART CAKE CASES
22743,MAKE YOUR OWN FLOWERPOWER CARD KIT
21191,LARGE WHITE HONEYCOMB PAPER BELL  
22874,NUMBER TILE COTTAGE GARDEN 6
21870,I CAN ONLY PLEASE ONE PERSON MUG
22450,SILK PURSE BABUSHKA BLUE
22190,LOCAL CAFE MUG
84993B,75 BLACK PETIT FOUR CASES
90129E,PURPLE GLASS TASSLE BAG CHARM
85130A,BEADED PEARL HEART WHITE LARGE
21584,RETROSPOT SMALL TUBE MATCHES
22715,CARD WEDDING DAY
90177D,DROP DIAMANTE EARRINGS PURPLE
84795b,SUNSET CHECK HAMMOCK
90214K,"""LETTER """"K"""" BLING KEY RING"""
72598,SET/12 TAPER CANDLES
21368,MIRRORED WALL ART LADIES
22636,CHILDS BREAKFAST SET CIRCUS PARADE
22849,BREAD BIN DINER STYLE MINT
90124B,BLUE MURANO TWIST NECKLACE
90161D,ANT COPPER PINK BOUDICCA BRACELET
20712,JUMBO BAG WOODLAND ANIMALS
90042C,FRESHWATER PEARL BRACELET IVORY
20957,PORCELAIN HANGING BELL SMALL
37474,
21736,GOLD SCROLL GLASS T-LIGHT HOLDER
84912B,GREEN ROSE WASHBAG
22686,FRENCH BLUE METAL DOOR SIGN No
21329,DINOSAURS  WRITING SET 
22315,200 RED + WHITE BENDY STRAWS
72799F,IVORY PILLAR CANDLE GOLD FLOCK
90082A,DIAMANTE BOW BROOCH GREEN COLOUR
21528,DAIRY MAID TRADITIONAL TEAPOT 
22523,CHILDS GARDEN FORK PINK
22572,ROCKING HORSE GREEN CHRISTMAS 
71495B,CD WALL TIDY RED FLOWERS
90024F,NEW BAROQUE B'FLY NECKLACE CRYSTAL
21259,VICTORIAN SEWING BOX SMALL 
22739,RIBBON REEL CHRISTMAS SOCK BAUBLE
21135,VICTORIAN  METAL POSTCARD SPRING
22680,FRENCH BLUE METAL DOOR SIGN 5
22199,FRYING PAN RED RETROSPOT
20941,
20685,DOORMAT RED RETROSPOT
22364,GLASS JAR DIGESTIVE BISCUITS
22180,RETROSPOT LAMP
22849,"""BREAD BIN"
84683,CLASSICAL ROSE CANDLESTAND
22976,CIRCUS PARADE CHILDRENS EGG CUP 
22606,WOODEN SKITTLES GARDEN SET
84249A,"""GREETING CARD"
22624,IVORY KITCHEN SCALES
22525,CHILDRENS GARDEN GLOVES PINK
22176,BLUE OWL SOFT TOY
46000M,POLYESTER FILLER PAD 45x45cm
22102,MIRROR MOSAIC T-LIGHT HOLDER 
21750,LARGE SKULL WINDMILL
22436,12 COLOURED PARTY BALLOONS
85198,ASSORTED FARMYARD ANIMALS IN BUCKET
21675,BUTTERFLIES STICKERS
21696,
85131B,BEADED CRYSTAL HEART GREEN ON STICK
62094B,TURQ ICE CREAM BUM BAG 
22218,CAKE STAND LACE WHITE
84029E,RED WOOLLY HOTTIE WHITE HEART.
21866,UNION JACK FLAG LUGGAGE TAG
22092,BLUE PAISLEY TISSUE BOX
84916,HAND TOWEL PALE BLUE W FLOWERS
84849A,HELLO SAILOR BLUE SOAP HOLDER
84388,WISE MAN STAR SHAPE EGG PAN
21262,WHITE GOOSE FEATHER CHRISTMAS TREE 
22164,STRING OF STARS CARD HOLDER
71477,COLOUR GLASS. STAR T-LIGHT HOLDER
21847,GREEN  DIAMANTE PEN IN GIFT BOX
21828,EIGHT PIECE SNAKE  SET
21420,OYSTER TRINKET BOX
22167, OVAL WALL MIRROR DIAMANTE 
90010B,BLACK/WHITE GLASS/SILVER BRACELET
21383,PACK OF 12 STICKY BUNNIES
22854,CREAM SWEETHEART EGG HOLDER
22954,HEN PARTY CORDON BARRIER TAPE
21650,ASSORTED TUTTI FRUTTI BRACELET
84968a,SET OF 16 VINTAGE ROSE CUTLERY
22571,ROCKING HORSE RED CHRISTMAS 
35833G,damages
22544,MINI JIGSAW SPACEBOY
90039B,FIRE POLISHED GLASS BRACELET MONTAN
72349B,SET/6 PURPLE BUTTERFLY T-LIGHTS
21577,SAVE THE PLANET COTTON TOTE BAG
84595E,LARGE TORTILLA DESIGN RED BOWL
21306,SET/4 DAISY MIRROR MAGNETS
90182C,BLACK 3 BEAD DROP EARRINGS
22357,KINGS CHOICE BISCUIT TIN
84600,NEW BAROQUE JEWELLERY BOX 
22633,HAND WARMER UNION JACK
22179,SET 10 LIGHTS NIGHT OWL
16156L,"""WRAP"
22938,CUPCAKE LACE PAPER SET 6
90201A,PURPLE ENAMEL FLOWER RING
85038,6 CHOCOLATE LOVE HEART T-LIGHTS
72349b,SET/6 PURPLE BUTTERFLY T-LIGHTS
85062,PEARL CRYSTAL PUMPKIN T-LIGHT HLDR
22166,WALL MIRROR RECTANGLE DIAMANTE PINK
21270,ANTIQUE CREAM CUTLERY CUPBOARD
21905,MORE BUTTER METAL SIGN 
22333,RETROSPOT PARTY BAG + STICKER SET
22098,BOUDOIR SQUARE TISSUE BOX
90140,PINK SWEETIE NECKLACE
22182,CAKE STAND VICTORIAN FILIGREE SMALL
21810,CHRISTMAS HANGING STAR WITH BELL
22285,"""DECORATION HEN ON NEST"
90058B,CRYSTAL STUD EARRINGS ASSORTED COL 
22084,PAPER CHAIN KIT EMPIRE
85114a,BLACK ENCHANTED FOREST PLACEMAT
22587,FELTCRAFT HAIRBAND RED AND BLUE
21354,TOAST ITS - BEST MUM
22090,PAPER BUNTING RETROSPOT
22495,SET OF 2 ROUND TINS CAMEMBERT 
20674,GREEN POLKADOT BOWL
20963,APPLE BATH SPONGE
20768,GREEN FERN JOURNAL 
22171,3 HOOK PHOTO SHELF ANTIQUE WHITE
22972,CHILDRENS SPACEBOY MUG
90214B,"""LETTER """"B"""" BLING KEY RING"""
21031,SPACE CADET BLACK
90019C,SILVER BLACK ORBIT BRACELET
22117,METAL SIGN HER DINNER IS SERVED 
90087,CRYSTAL SEA HORSE PHONE CHARM
21527,RED RETROSPOT TRADITIONAL TEAPOT 
22326,ROUND SNACK BOXES SET OF4 WOODLAND 
85017A,ENVELOPE 50 ROMANTIC IMAGES
22136,LOVE HEART SOCK HANGER
16236,KITTY PENCIL ERASERS
20847,ZINC HEART LATTICE CHARGER LARGE
22892,SET OF SALT AND PEPPER TOADSTOOLS
21454,PAINTED PINK RABBIT 
47599A,PINK PARTY BAGS
90181B,AMETHYST GLASS/SHELL/PEARL NECKLACE
21741,COSY SLIPPER SHOES LARGE GREEN
21317,GLASS SPHERE CANDLE STAND MEDIUM
40001,WHITE BAMBOO RIBS LAMPSHADE
22602,CHRISTMAS RETROSPOT HEART WOOD
35610B,BLACK CHRISTMAS FLOCK DROPLET 
21530,DAIRY MAID TOASTRACK
35001W,
21849,SILVER DIAMANTE PEN IN GIFT BOX
20704,MR ROBOT SOFT TOY
22329,ROUND CONTAINER SET OF 5 RETROSPOT
20675,BLUE POLKADOT BOWL
21162,TOXIC AREA  DOOR HANGER 
22381,TOY TIDY PINK POLKADOT
21288,STRIPEY CHOCOLATE NESTING BOXES
47591D,PINK FAIRY CAKE CHILDRENS APRON
84926D,LA PALMIERA TILE COASTER
90079,VINTAGE ENAMEL & CRYSTAL NECKLACE
21499,BLUE POLKADOT WRAP
90214S,"""LETTER """"S"""" BLING KEY RING"""
47590b,PINK HAPPY BIRTHDAY BUNTING
90210A,GREY ACRYLIC FACETED BANGLE
21888,BINGO SET
84997D,PINK 3 PIECE POLKADOT CUTLERY SET
20828,GLITTER BUTTERFLY CLIPS
79190B,RETRO PLASTIC POLKA TRAY
22529,MAGIC DRAWING SLATE GO TO THE FAIR 
17164B,ASS COL SMALL SAND GECKO P'WEIGHT
35957,SMALLFOLKART BAUBLE CHRISTMAS DEC
72803B,
20798,CLEAR MILKSHAKE GLASS
85025B,EAU DE NILE HEART SHAPE PHOTO FRAME
22781,GUMBALL MAGAZINE RACK
84614A,PINK BAROQUE FLOCK CANDLE HOLDER
22897,OVEN MITT APPLES DESIGN
85206A,CREAM FELT EASTER EGG BASKET
84905,PINK BUTTERFLY CUSHION COVER 
22569,FELTCRAFT CUSHION BUTTERFLY
17096,ASSORTED LAQUERED INCENSE HOLDERS
79149B,SILICON STAR BULB  BLUE
85203,HANGING WOOD AND FELT BUTTERFLY 
21509,COWBOYS AND INDIANS BIRTHDAY CARD 
62018,SOMBRERO 
90128C,GREEN LEAVES AND BEADS PHONE CHARM
82583,HOT BATHS METAL SIGN
90031,BILI NUT AND WOOD NECKLACE
21503,TOYBOX  WRAP 
22972,CHILDREN'S SPACEBOY MUG
85071B,RED CHARLIE+LOLA PERSONAL DOORSIGN
85170A,SET/6 IVORY BIRD T-LIGHT CANDLES
21400,RED PUDDING SPOON
47503H,ASS FLORAL PRINT SPIRIT LEVEL 
10125,MINI FUNKY DESIGN TAPES
90014B,GOLD M PEARL  ORBIT NECKLACE
22458,CAST IRON HOOK GARDEN FORK
21041,RED RETROSPOT OVEN GLOVE DOUBLE
90082B,DIAMANTE BOW BROOCH RED COLOUR
90173,PAIR BUTTERFLY HAIR CLIPS
85184C,S/4 VALENTINE DECOUPAGE HEART BOX
21263,GREEN GOOSE FEATHER TREE 60CM
84459B,YELLOW METAL CHICKEN HEART 
90214J,"""LETTER """"J"""" BLING KEY RING"""
37447,CERAMIC CAKE DESIGN SPOTTED PLATE
84827,ASS DES PHONE SPONGE CRAFT STICKER
35920,FOUR RABBIT EASTER DECORATIONS
90011B,BLACK CRYSTAL DROP EARRINGS
85035B,CHOCOLATE 3 WICK MORRIS BOX CANDLE
21723,ALPHABET HEARTS STICKER SHEET
21082,SET/20 FRUIT SALAD PAPER NAPKINS 
85087,CANDY SPOT CUSHION COVER
21070,VINTAGE BILLBOARD MUG 
85032D,YULETIDE IMAGES GIFT WRAP SET
20981,12 PENCILS TALL TUBE WOODLAND
82616B,FRAPPUCINO SCARF KNITTING KIT
35610A,PINK CHRISTMAS FLOCK DROPLET 
20711,JUMBO BAG TOYS 
85025C,PINK HEART SHAPE PHOTO FRAME
21224,SET/4 SKULL BADGES
85034A,3 GARDENIA MORRIS BOXED CANDLES
22218,
22502,reverse 21/5/10 adjustment
84952C,MIRROR LOVE BIRD T-LIGHT HOLDER
22206,"""MUG "
22919,HERB MARKER MINT
84951B,SET OF 4 BLACK LOVEBIRD COASTERS
22578,WOODEN STAR CHRISTMAS SCANDINAVIAN
21069,VINTAGE BILLBOARD TEA MUG
90187B,GREEN DROP EARRINGS W BEAD CLUSTER
71143,SILVER BOOK MARK WITH BEADS
22203,MILK PAN RED RETROSPOT
47503J,SET/3 FLORAL GARDEN TOOLS IN BAG
90130C,GREEN STONE/CRYSTAL EARRINGS
22283,6 EGG HOUSE PAINTED WOOD
17011F,ORIGAMI SANDLEWOOD INCENSE+FLOWER
21360,JOY LARGE WOOD LETTERS
85031C,CURIOUS IMAGES SCRAP BOOK SET
90129F,RED GLASS TASSLE BAG CHARM
84688,BEACH HUT DESIGN BLACKBOARD
82011A,"""BATHROOM SCALES"
85199L,LARGE HANGING IVORY & RED WOOD BIRD
44235,ASS COL CIRCLE MOBILE 
90176B,DIAMANTE NECKLACE BLACK 
22912,YELLOW COAT RACK PARIS FASHION
22142,CHRISTMAS CRAFT WHITE FAIRY 
37500,TEA TIME TEAPOT IN GIFT BOX
85032B,BLOSSOM IMAGES GIFT WRAP SET
22087,PAPER BUNTING WHITE LACE
21058,PARTY INVITES WOODLAND
17107D,"""FLOWER FAIRY"
21726,MULTI HEARTS  STICKERS
22581,WOOD STOCKING CHRISTMAS SCANDISPOT
72819,CUPID DESIGN SCENTED CANDLES
22394,PAPERWEIGHT KINGS CHOICE 
22342,HOME GARLAND PAINTED ZINC 
22860,EASTER TIN CHICKS PINK DAISY
16258A,SWIRLY CIRCULAR RUBBERS IN BAG
21018,BIRD BOX CHRISTMAS TREE DECORATION
20780,BLACK EAR MUFF HEADPHONES
22608,PENS ASSORTED FUNKY JEWELED 
22303,COFFEE MUG APPLES DESIGN
84674,FLYING PIG WATERING CAN
21412,VINTAGE GOLD TINSEL REEL
90194,SILVER LARIAT BLACK STONE EARRINGS
35809A,ENAMEL PINK TEA CONTAINER
85183B,CHARLIE & LOLA WASTEPAPER BIN FLORA
21690,SILVER  CANDLEPOT JARDIN 
21218,RED SPOTTY BISCUIT TIN
85187,S/12 MINI RABBIT EASTER
85114b,IVORY ENCHANTED FOREST PLACEMAT
79030D,"""TUMBLER"
22273,FELTCRAFT DOLL MOLLY
21128,GOLD FISHING GNOME
22801,ANTIQUE GLASS PEDESTAL BOWL
35915B,BLUE KNITTED HEN 
85040a,S/4 PINK FLOWER CANDLES IN BOWL
20894,HANGING BAUBLE T-LIGHT HOLDER LARGE
37342,POLKADOT COFFEE CUP & SAUCER PINK
21655,HANGING RIDGE GLASS T-LIGHT HOLDER
21188,3D HEARTS  HONEYCOMB PAPER GARLAND
21626,VINTAGE UNION JACK PENNANT
22908,PACK OF 20 NAPKINS RED APPLES
22168,ORGANISER WOOD ANTIQUE WHITE 
21413,PERIWINKLE T-LIGHT HOLDER
21429,
21065,BOOM BOX SPEAKER GIRLS
21694,SMALL REGAL  SILVER CANDLEPOT 
84820,DANISH ROSE TRINKET TRAYS
22618,COOKING SET RETROSPOT
22775,PURPLE DRAWERKNOB ACRYLIC EDWARDIAN
22198,
21645,ASSORTED TUTTI FRUTTI ROUND BOX
90205A,LARGE MINT DIAMANTE HAIRSLIDE
21378,SMALL TALL CAMPHOR WOOD TOADSTOOL
85177,BASKET OF FLOWERS SEWING KIT
21561,DINOSAUR LUNCH BOX WITH CUTLERY
15044A,PINK PAPER PARASOL 
84906,PINK B'FLY C/COVER W BOBBLES
15044D,RED PAPER PARASOL
21713,CITRONELLA CANDLE FLOWERPOT
21415,CLAM SHELL SMALL 
84917,WHITE HAND TOWEL WITH BUTTERFLY
21899,"""KEY FOB "
90005A,JADE GREEN ENAMEL HAIR COMB
85084,
21555,CERAMIC STRAWBERRY TRINKET TRAY
22417,PACK OF 60 SPACEBOY CAKE CASES
22296,HEART IVORY TRELLIS LARGE
21559,STRAWBERRY LUNCH BOX WITH CUTLERY
22423,REGENCY CAKESTAND 3 TIER
35910A,MULTICOLOUR EASTER RABBIT 
85194S,HANGING SPRING FLOWER EGG SMALL
22535,MAGIC DRAWING SLATE BUNNIES 
85099f,JUMBO BAG STRAWBERRY
21586,KINGS CHOICE GIANT TUBE MATCHES
21627,ELEPHANT CARNIVAL POUFFE
22895,SET OF 2 TEA TOWELS APPLE AND PEARS
85071C,"""CHARLIE+LOLA""""EXTREMELY BUSY"""" SIGN"""
90188,DROP EARRINGS W FLOWER & LEAF
35933,PINK STOCKING CHRISTMAS DECORATION
85132a,CHARLIE + LOLA BISCUITS TINS
35001G,HAND OPEN SHAPE GOLD
85135C,RED DRAGONFLY HELICOPTER
84927E,FLOWERS TILE HOOK
21289,LARGE STRIPES CHOCOLATE GIFT BAG
85144,JARDIN ETCHED GLASS CHEESE DISH
35271S,
18098C,PORCELAIN BUTTERFLY OIL BURNER
22812,PACK 3 BOXES CHRISTMAS PANNETONE
21424,WOODLAND STORAGE BOX LARGE 
35968,FOLK ART METAL HEART T-LIGHT HOLDER
35609A,PINK FEATHER CHRISTMAS DECORATION
20615,BLUE POLKADOT PASSPORT COVER
21644,found
21448,12 DAISY PEGS IN WOOD BOX
84707B,PINK JEWELLED MIRROR TRINKET TRAY
22586,FELTCRAFT HAIRBAND PINK AND BLUE
84968D,SET OF 16 VINTAGE RED CUTLERY
72816,SET/3 CHRISTMAS DECOUPAGE CANDLES
22700,BLACK AND WHITE DOG BOWL
84536A,ENGLISH ROSE NOTEBOOK A7 SIZE
20666,ECONOMY HOLIDAY PURSE
37479B,CUBIC MUG FLOCK BLUE ON BROWN
79144B,PAINTED LIGHTBULB STAR+ MOON
22174,PHOTO CUBE
22776,SWEETHEART CAKESTAND 3 TIER
84929,ASSTD FRUIT+FLOWERS FRIDGE MAGNETS
21107,CREAM SLICE FLANNEL PINK SPOT 
22366,DOORMAT AIRMAIL 
84270,ASSTD DESIGN BUBBLE GUM RING
90212B,JET BLACK LAS VEGAS BRACELET ROUND
16016,LARGE CHINESE STYLE SCISSOR
90141A,GREEN PENDANT TRIPLE SHELL NECKLACE
22767,TRIPLE PHOTO FRAME CORNICE 
85211,S/4 GROOVY CAT MAGNETS
84922,PINK BUTTERFLY WASHBAG
22501,PICNIC BASKET WICKER LARGE
21108,FAIRY CAKE FLANNEL ASSORTED COLOUR
37379A,PINK CHERRY BLOSSOM CUP & SAUCER
22957,SET 3 PAPER VINTAGE CHICK PAPER EGG
22584,PACK OF 6 PANNETONE GIFT BOXES
82599,FANNY'S REST STOPMETAL SIGN
21533,RETROSPOT LARGE MILK JUG
35241,ENAMEL BLUE RIM BISCUIT BIN
82613A,"""METAL SIGN"
22053,EMPIRE DESIGN ROSETTE
84968f,SET OF 16 VINTAGE SKY BLUE CUTLERY
21719,LOVELY BONBON STICKER SHEET
72800E,4 IVORY DINNER CANDLES SILVER FLOCK
22377,BOTTLE BAG RETROSPOT 
84992,72 SWEETHEART FAIRY CAKE CASES
84660B,BLACK STITCHED WALL CLOCK
20826,SILVER APERITIF GLASS
21658,GLASS  BEURRE DISH
84660C,PINK STITCHED WALL CLOCK
22952,72 CAKE CASES VINTAGE CHRISTMAS
72586,SET OF 6 HALLOWEEN GHOST T-LIGHTS
37333,"""RETRO """"TEA FOR ONE"""" """
21192,WHITE BELL HONEYCOMB PAPER 
16033,MINI HIGHLIGHTER PENS
21379,CAMPHOR WOOD PORTOBELLO MUSHROOM
84625A,PINK NEW BAROQUECANDLESTICK CANDLE
22156,HEART DECORATION WITH PEARLS 
84507B,STRIPES DESIGN MONKEY DOLL
47591B,SCOTTIES CHILDRENS APRON
90129A,PINK GLASS TASSLE BAG CHARM 
22444,GROW YOUR OWN PLANT IN A CAN 
22706,WRAP COWBOYS  
21504,SKULLS GREETING CARD
72802A,ROSE SCENT CANDLE IN JEWELLED BOX
37489B,BLUE/YELLOW FLOWER DESIGN BIG MUG
21164,HOME SWEET HOME METAL SIGN 
22028,
21473,SWEETHEART CREAM STEEL TABLE RECT
21889,WOODEN BOX OF DOMINOES
22845,VINTAGE CREAM CAT FOOD CONTAINER
22258,FELT FARM ANIMAL RABBIT
90101,WHITE FRANGIPANI NECKLACE
85232D,SET/3 DECOUPAGE STACKING TINS
21257,VICTORIAN SEWING BOX MEDIUM
46000S,Dotcom sales
22859,EASTER TIN BUNNY BOUQUET
22903,CALENDAR FAMILY FAVOURITES
84987,SET OF 36 TEATIME PAPER DOILIES
21815,STAR  T-LIGHT HOLDER 
22419,LIPSTICK PEN RED
84970L,SINGLE HEART ZINC T-LIGHT HOLDER
90199D,5 STRAND GLASS NECKLACE AMBER
37491A,YELLOW/PINK CERAMIC CANDLE HOLDER
84429A,MEDIUM PINK BUDDHA HEAD 
20849,
20622,VIPPASSPORT COVER 
20956,PORCELAIN T-LIGHT HOLDERS ASSORTED
22023,EMPIRE BIRTHDAY CARD
84509B,SET OF 4 FAIRY CAKE PLACEMATS
22909,SET OF 20 VINTAGE CHRISTMAS NAPKINS
16010,FOLDING CAMPING SCISSOR W/KNIF & S
22108,PING! MICROWAVE PLATE
21464,DISCO BALL ROTATOR BATTERY OPERATED
22061,LARGE CAKE STAND  HANGING STRAWBERY
84534b,FAIRY CAKE NOTEBOOK A5 SIZE
84985A,SET OF 72 GREEN PAPER DOILIES
90175A,WHITE GLASS CHUNKY CHARM BRACELET
37444A,YELLOW BREAKFAST CUP AND SAUCER
20752,BLUE POLKADOT WASHING UP GLOVES
22778,GLASS BELL JAR SMALL
21558,SKULL LUNCH BOX WITH CUTLERY 
84997b,RED 3 PIECE RETROSPOT CUTLERY SET
22666,RECIPE BOX PANTRY YELLOW DESIGN
22643,SET OF 4 NAPKIN CHARMS LEAVES   
85067,CREAM SWEETHEART WALL CABINET
21392,RED POLKADOT PUDDING BOWL
22515,CHILDS GARDEN SPADE PINK
84569A,PACK 3 IRON ON DOG PATCHES
20679,EDWARDIAN PARASOL RED
22503,CABIN BAG VINTAGE PAISLEY
21947,SET OF 6 HEART CHOPSTICKS
22665,RECIPE BOX BLUE SKETCHBOOK DESIGN
22731,3D CHRISTMAS STAMPS STICKERS 
22212,FOUR HOOK  WHITE LOVEBIRDS
22029,SPACEBOY BIRTHDAY CARD
22403,MAGNETS PACK OF 4 VINTAGE LABELS 
21635,MADRAS NOTEBOOK LARGE 
20682,RED RETROSPOT CHILDRENS UMBRELLA
22929,SCHOOL DESK AND CHAIR 
21054,
22185,SLATE TILE NATURAL HANGING
22655,VINTAGE RED KITCHEN CABINET
90209C,PINK ENAMEL+GLASS HAIR COMB
85232A,SET/3 POLKADOT STACKING TINS
72801d,4 SKY BLUE DINNER CANDLES
90163A,PINK ROSEBUD & PEARL NECKLACE
22459,CAST IRON HOOK GARDEN TROWEL
21742,LARGE ROUND WICKER PLATTER 
90013D,PURPLE VINTAGE EARRINGS
90200C,BLUE SWEETHEART BRACELET
90214E,"""LETTER """"E"""" BLING KEY RING"""
85104,SILVER GLASS T-LIGHT SET
79403,FROSTED WHITE BASE 
22255,FELT TOADSTOOL  SMALL
90073,VINTAGE ENAMEL & CRYSTAL EARRINGS
84766,SILVER ROCOCO CANDLE STICK
84975,HEART SHAPED MIRROR
22188,BLACK HEART CARD HOLDER
22220,CAKE STAND LOVEBIRD 2 TIER WHITE
35971,ROSE FOLKART HEART DECORATIONS
72803A,ROSE SCENT CANDLE JEWELLED DRAWER
90169,DAISY HAIR COMB
22257,FELT FARM ANIMAL SHEEP
21009,ETCHED GLASS STAR TREE DECORATION
84884A,ANT WHITE WIRE HEART SPIRAL
22619,SET OF 6 SOLDIER SKITTLES
84997c,BLUE 3 PIECE POLKADOT CUTLERY SET
21429,RED GINGHAM ROSE JEWELLERY BOX
21291,SMALL POLKADOT CHOCOLATE GIFT BAG 
15058A,BLUE POLKADOT GARDEN PARASOL
82613C,"""METAL SIGN"
22251,BIRDHOUSE DECORATION MAGIC GARDEN
84877B,GREEN ROUND COMPACT MIRROR
21198,WHITE HEART CONFETTI IN TUBE
82605,OLD DOC RUSSEL METAL SIGN
35909A,RABBIT EASTER DECORATION
21109,LARGE CAKE TOWEL CHOCOLATE SPOTS
37509,NEW ENGLAND MUG W GIFT BOX
84661C,PINK SQUARE TABLE CLOCK
22489,PACK OF 12 TRADITIONAL CRAYONS
90071,RUBY GLASS CLUSTER EARRINGS
21219,SET/4 BADGES BALLOON GIRL
47570b,TEA TIME TABLE CLOTH
22837,HOT WATER BOTTLE BABUSHKA 
21015,DARK BIRD HOUSE TREE DECORATION
22402,MAGNETS PACK OF 4 VINTAGE COLLAGE
84510c,SET OF 4 POLKADOT COASTERS
84597B,RETRO BROWN BALL ASHTRAY 
22613,PACK OF 20 SPACEBOY NAPKINS
22057,CERAMIC PLATE STRAWBERRY DESIGN
84989a,75 GREEN FAIRY CAKE CASES
22682,FRENCH BLUE METAL DOOR SIGN 7
20845,ZINC HEART LATTICE 2 WALL PLANTER
21777,RECIPE BOX WITH METAL HEART
16225,RATTLE SNAKE EGGS
21090,SET/6 COLLAGE PAPER PLATES
84857C,PINK MONTE CARLO HANDBAG
21664,RIDGED GLASS STORAGE JAR CREAM LID
21827,EIGHT PIECE CREEPY CRAWLIE SET
90059B,DIAMANTE HAIR GRIP PACK/2 BLACK DIA
21268,VINTAGE BLUE TINSEL REEL
22379,RECYCLING BAG RETROSPOT 
22594,CHRISTMAS GINGHAM TREE
90112,PINK DOLLY HAIR CLIPS
35598D,PINK/WHITE CHRISTMAS TREE 60CM
82605,
21718,RED METAL BEACH SPADE 
85024C,PINK SMALL JEWELLED PHOTOFRAME
21648,
84968B,
84945,MULTI COLOUR SILVER T-LIGHT HOLDER
22653,BUTTON BOX 
82613b,"""METAL SIGN"
gift_0001_20,Dotcomgiftshop Gift Voucher £20.00
90206A,GOLD DIAMANTE STAR BROOCH
85014B,RED RETROSPOT UMBRELLA
85016,SET OF 6 VINTAGE NOTELETS KIT
85159A,"""BLACK TEA"
90154,LAZER CUT NECKLACE W PASTEL BEADS
90195A,PURPLE GEMSTONE BRACELET
16218,CARTOON  PENCIL SHARPENERS
48138,DOORMAT UNION FLAG
22307,GOLD MUG BONE CHINA TREE OF LIFE
21562,HAWAIIAN GRASS SKIRT 
84926F,PSYCHEDELIC TILE COASTER
90152B,BLUE/GREEN SHELL NECKLACE W PENDANT
22561,WOODEN SCHOOL COLOURING SET
20860,GOLD COSMETICS BAG WITH BUTTERFLY
35646,VINTAGE BEAD PINK EVENING BAG
82484,WOOD BLACK BOARD ANT WHITE FINISH
22816,CARD MOTORBIKE SANTA
22591,CARDHOLDER GINGHAM CHRISTMAS TREE
84949,SILVER HANGING T-LIGHT HOLDER
51014C,"""FEATHER PEN"
90210B,CLEAR ACRYLIC FACETED BANGLE
84510C,SET OF 4 POLKADOT COASTERS
21307,SET/4 BUTTERFLY MIRROR MAGNETS
35916A,YELLOW FELT HANGING HEART W FLOWER
84989A,75 GREEN FAIRY CAKE CASES
21876,POTTERING MUG
47504K,ENGLISH ROSE GARDEN SECATEURS
90201C,RED ENAMEL FLOWER RING
20772,GARDEN PATH JOURNAL
17084P,DRAGONS BLOOD INCENSE
22931,BAKING MOULD HEART WHITE CHOCOLATE
84675,FROG KING WATERING CAN
22720,SET OF 3 CAKE TINS PANTRY DESIGN 
85174,S/4 CACTI CANDLES
84086C,PINK/PURPLE RETRO RADIO
21204,DAISIES  HONEYCOMB GARLAND 
47599B,BLUE PARTY BAGS 
22118,JOY WOODEN BLOCK LETTERS
84870B,BLUE GEISHA GIRL 
20902,VINTAGE KEEPSAKE BOX PARIS DAYS
84952B,BLACK LOVE BIRD T-LIGHT HOLDER
84568,GIRLS ALPHABET IRON ON PATCHES 
85150,LADIES & GENTLEMEN METAL SIGN
22498,WOODEN REGATTA BUNTING
48189,DOORMAT FRIENDSHIP 
22424,ENAMEL BREAD BIN CREAM
20759,CHRYSANTHEMUM POCKET BOOK 
21441,BLUE BIRDHOUSE DECORATION
21836,GINGHAM OVEN GLOVE RED HEART 
22261,FELT EGG COSY WHITE RABBIT 
21743,STAR PORTABLE TABLE LIGHT 
22027,TEA PARTY BIRTHDAY CARD
72351B,SET/6 PINK  BUTTERFLY T-LIGHTS
82582,AREA PATROLLED METAL SIGN
90185A,AMBER DIAMANTE EXPANDABLE RING
17129F,BLUE GLASS GEMS IN BAG
35810B,ENAMEL BLUE RIM COFFEE CONTAINER
17174,ASSTD RASTA KEY-CHAINS
22685,FRENCH BLUE METAL DOOR SIGN 0
35911A,MULTICOLOUR RABBIT EGG WARMER
22110,BIRD HOUSE HOT WATER BOTTLE
85202,HANGING WOOD AND FELT HEART
21349,
79323P,PINK CHERRY LIGHTS
22445,PENCIL CASE LIFE IS BEAUTIFUL
84877D,BLUE ROUND COMPACT MIRROR
22106,MIRROR MOSAIC HURRICANE LAMP 
21739,COSY SLIPPER SHOES SMALL GREEN
79066k,RETRO MOD TRAY
22824,3 TIER SWEETHEART GARDEN SHELF
22395,PAPERWEIGHT VINTAGE PAISLEY
22778,GLASS CLOCHE SMALL
85195,HANGING HEART BASKET
22074,6 RIBBONS SHIMMERING PINKS 
22114,HOT WATER BOTTLE TEA AND SYMPATHY
21294,ETCHED GLASS COASTER
84689,
47593A,CAROUSEL PONIES BABY BIB
22314,OFFICE MUG WARMER CHOC+BLUE
21059,PARTY INVITES DINOSAURS
22141,CHRISTMAS CRAFT TREE TOP ANGEL
85014a,BLACK/BLUE POLKADOT UMBRELLA
35916B,BLUE FELT HANGING HEART W FLOWER
90120A,PINK MURANO TWIST BRACELET
35911B,PINK/FLOWER RABBIT EGG WARMER 
90123B,TURQUOISE HEART OF GLASS BRACELET
75013B,"""STRING OF 8 BUTTERFLIES"
84661A,WHITE SQUARE TABLE CLOCK
90160C,TURQ+RED BOUDICCA LARGE BRACELET
79030G,"""TUMBLER"
22883,NUMBER TILE VINTAGE FONT 4
22947,WOODEN ADVENT CALENDAR RED
22250,DECORATION  BUTTERFLY  MAGIC GARDEN
20906,VINTAGE NOTEBOOK BEAUTY GIRL
82581,TOILET METAL SIGN
21628,TRIANGULAR POUFFE VINTAGE 
21989,PACK OF 20 SKULL PAPER NAPKINS
85208,SET/12 FUNKY FELT FLOWER PEG IN BAG
37501,TEA TIME TEA SET IN GIFT BOX
10120,DOGGY RUBBER
22609,PENS ASSORTED SPACEBALL
90141C,TURQ PENDANT TRIPLE SHELL NECKLACE
90156,RESIN BRACELET W PASTEL BEADS
72800B, 4 PURPLE FLOCK DINNER CANDLES
20735,BLACK MINI TAPE MEASURE 
84865,NEW BAROQUE BLACK PHOTO ALBUM
84559b,3D SHEET OF CAT STICKERS
BANK CHARGES,Bank Charges
84006,MAGIC TREE -PAPER FLOWERS
84924A,WAKE UP COCKEREL CALENDAR SIGN 
22269,EGG CUP NATURAL CHICKEN
21416,CLAM SHELL LARGE
79071B,ENGLISH ROSE METAL WASTE BIN
22346,PARTY PIZZA DISH GREEN POLKADOT
84840,
84422,PINK/BLUE DISC/MIRROR STRING
20694,FLORAL PINK MONSTER
22779,WOODEN OWLS LIGHT GARLAND 
22288,HANGING METAL RABBIT DECORATION
85125,SMALL ROUND CUT GLASS CANDLESTICK
22640,SET OF 4 NAPKIN CHARMS 3 KEYS 
22631,CIRCUS PARADE LUNCH BOX 
21949,SET OF 6 STRAWBERRY CHOPSTICKS
22573,STAR WOODEN CHRISTMAS DECORATION
22413,METAL SIGN TAKE IT OR LEAVE IT 
85226A,
85231b,CINAMMON SET OF 9 T-LIGHTS
22466,FAIRY TALE COTTAGE NIGHTLIGHT
20839,FRENCH PAISLEY CUSHION COVER 
16219,HOUSE SHAPE PENCIL SHARPENER
21280,VINTAGE KITCHEN PRINT VEGETABLES
22597,CHRISTMAS MUSICAL ZINC HEART 
90036F,"""FLOWER GLASS GARLD NECKL36""""TURQUOIS"""
22844,VINTAGE CREAM DOG FOOD CONTAINER
21240,BLUE POLKADOT CUP
47566B,TEA TIME PARTY BUNTING
22088,PAPER BUNTING COLOURED LACE
79302M,"""ART LIGHTS"
85146,JARDIN ETCHED GLASS SMALL BELL JAR
85008,SET OF 3 CONEY ISLAND OVAL BOXES
21366,MIRRORED WALL ART PHOTO FRAMES
79323W,WHITE CHERRY LIGHTS
37449,CERAMIC CAKE STAND + HANGING CAKES
21581,SKULLS  DESIGN  COTTON TOTE BAG
22605,WOODEN CROQUET GARDEN SET
20659,ECONOMY LUGGAGE TAG
90003D,CRYSTAL PAIR HEART HAIR SLIDES
85119,WATERING CAN SINGLE HOOK PISTACHIO
79164,BLACK WINE GLASS
90214Z,"""LETTER """"Z"""" BLING KEY RING"""
90099,NECKLACE+BRACELET SET BLUE HIBISCUS
90125E,AMBER BERTIE GLASS BEAD BAG CHARM
22632,HAND WARMER RED RETROSPOT
21865,PINK UNION JACK  PASSPORT COVER 
85216,ASSORTED CAKES FRIDGE MAGNETS
90112,
84926A,WAKE UP COCKEREL TILE COASTER
35400,
22279,POCKET BAG BLUE PAISLEY RED SPOT
18007,ESSENTIAL BALM 3.5g TIN IN ENVELOPE
85023B,EAU DE NILE JEWELLED PHOTOFRAME
20774,GREEN FERN NOTEBOOK
22256,FELT FARM ANIMAL CHICKEN
21479,?
22738,RIBBON REEL SNOWY VILLAGE
48185,DOORMAT FAIRY CAKE
71279,PINK GLASS CANDLEHOLDER
85169B,BLACK LOVE BIRD CANDLE
85130D,BEADED CRYSTAL HEART PINK LARGE
21669,BLUE STRIPE CERAMIC DRAWER KNOB
90214O,"""LETTER """"O"""" BLING KEY RING"""
22448,PIN CUSHION BABUSHKA RED
21328,BALLOONS  WRITING SET 
22375,AIRLINE BAG VINTAGE JET SET BROWN
21039,RED RETROSPOT SHOPPING BAG
82613B,"""METAL SIGN"
20998,ROSE DU SUD OVEN GLOVE
47503A,ASS FLORAL PRINT MULTI SCREWDRIVER
21032,SPACE CADET WHITE
90163B,WHITE ROSEBUD & PEARL NECKLACE
21735,TWO DOOR CURIO CABINET
90001C,ANTIQUE OPAL WHITE FLOWER EARRINGS
75178,ASSTD COL BUTTERFLY/CRYSTAL W/CHIME
10133,COLOURING PENCILS BROWN TUBE
21272,SALLE DE BAIN HOOK
21126,SET OF 6 GIRLS CELEBRATION CANDLES
21813,GARLAND WITH STARS AND BELLS
21159,MOODY BOY  DOOR HANGER 
22493,PAINT YOUR OWN CANVAS SET
84673A,PINK FLY SWAT
85094,CANDY SPOT EGG WARMER RABBIT
21336,GOLD WASHBAG
84970s,HANGING HEART ZINC T-LIGHT HOLDER
84675,
20707,CRAZY DAISY HEART DECORATION
21098,CHRISTMAS TOILET ROLL
21137,BLACK RECORD COVER FRAME
21668,RED STRIPE CERAMIC DRAWER KNOB
22316,200 BENDY SKULL STRAWS
22081,RIBBON REEL FLORA + FAUNA 
21987,PACK OF 6 SKULL PAPER CUPS
21063,PARTY INVITES JAZZ HEARTS
21171,BATHROOM METAL SIGN 
22567,20 DOLLY PEGS RETROSPOT
22690,DOORMAT HOME SWEET HOME BLUE 
22199,FRYING PAN RED POLKADOT 
22422,TOOTHPASTE TUBE PEN
22592,CARDHOLDER HOLLY WREATH METAL
22460,EMBOSSED GLASS TEALIGHT HOLDER
22461,SAVOY ART DECO CLOCK
