90200D,PINK SWEETHEART BRACELET
21967,PACK OF 12 SKULL TISSUES
20728,LUNCH BAG CARS BLUE
84050,counted
85035C,ROSE 3 WICK MORRIS BOX CANDLE
21324,HANGING MEDINA LANTERN SMALL
22649,STRAWBERRY FAIRY CAKE TEAPOT
21033,JUMBO BAG CHARLIE AND LOLA TOYS
22127,PARTY CONES CARNIVAL ASSORTED
20914,SET/5 RED RETROSPOT LID GLASS BOWLS
21011,GLITTER SNOW PEAR TREE DECORATION
22675,FRENCH KITCHEN SIGN BLUE METAL
22367,CHILDRENS APRON SPACEBOY DESIGN
85180B,PINK HEARTS LIGHT CHAIN 
22443,GROW YOUR OWN HERBS SET OF 3
21418,STARFISH SOAP DISH
84968E,SET OF 16 VINTAGE BLACK CUTLERY
85135A,YELLOW DRAGONFLY HELICOPTER
72130,COLUMBIAN CANDLE ROUND
21666,RIDGED GLASS T-LIGHT HOLDER
16206B,RED PURSE WITH PINK HEART
21667,GLASS CAKE COVER AND PLATE
22629,SPACEBOY LUNCH BOX 
15039,SANDALWOOD FAN
84836,ZINC METAL HEART DECORATION
84923,PINK BUTTERFLY HANDBAG W BOBBLES
21871,SAVE THE PLANET MUG
35970,ZINC FOLKART SLEIGH BELLS
22721,SET OF 3 CAKE TINS SKETCHBOOK
22965,3 TRADITIONAL COOKIE CUTTERS  SET
21619,4 VANILLA BOTANICAL CANDLES
82616C,MIDNIGHT GLAMOUR SCARF KNITTING KIT
22094,RED RETROSPOT TISSUE BOX
20978,36 PENCILS TUBE SKULLS
84925D,LA PALMIERA WALL THERMOMETER
37474,SET/4 2 TONE EGG SHAPE MIXING BOWLS
21933,PINK VINTAGE PAISLEY PICNIC BAG
35832,WOOLLY HAT SOCK GLOVE ADVENT STRING
84558A,3D DOG PICTURE PLAYING CARDS
22880,NUMBER TILE VINTAGE FONT 1
16161U,WRAP SUKI AND FRIENDS
22823,CHEST NATURAL WOOD 20 DRAWERS
90042C,
22504,CABIN BAG VINTAGE RETROSPOT
85048,15CM CHRISTMAS GLASS BALL 20 LIGHTS
85136C,RED SHARK HELICOPTER
90145,SILVER HOOP EARRINGS WITH FLOWER
84380,SET OF 3 BUTTERFLY COOKIE CUTTERS
21278,VINTAGE KITCHEN PRINT PUDDINGS
22299,PIG KEYRING WITH LIGHT & SOUND 
22641,SET OF 4 NAPKIN CHARMS INSTRUMENT
18097C,WHITE TALL PORCELAIN T-LIGHT HOLDER
90167,BEADED LOVE HEART JEWELLERY SET
84617,NEW BAROQUE BLACK BOXES
84559A,3D SHEET OF DOG STICKERS
22115,METAL SIGN EMPIRE TEA
21372,MIRRORED WALL ART TABLE LAMP
90041,PEARL AND CHERRY QUARTZ BRACLET
22762,CUPBOARD 3 DRAWER MA CAMPAGNE
85231g,ORANGE SCENTED SET/9 T-LIGHTS
22548,HEADS AND TAILS SPORTING FUN
21633,SUNFLOWER DECORATIVE PARASOL
22435,SET OF 9 HEART SHAPED BALLOONS
21439,BASKET OF TOADSTOOLS
22341,LOVE GARLAND PAINTED ZINC 
85008,
85111,SILVER GLITTER FLOWER VOTIVE HOLDER
21993,FLORAL FOLK STATIONERY SET
21671,RED SPOT CERAMIC DRAWER KNOB
84658,WHITE STITCHED CUSHION COVER
84968C,SET OF 16 VINTAGE PISTACHIO CUTLERY
90186B,CRYSTAL HOOP EARRING FLORAL LEAF
90060D,FIRE POLISHED GLASS NECKL BRONZE
22814,CARD PARTY GAMES 
21714,CITRONELLA CANDLE GARDEN POT
21293,MIRRORED DOVE WALL DECORATION
18094C,WHITE AND BLUE CERAMIC OIL BURNER
84613A,PINK NEW BAROQUE FLOCK CANDLESTICK
21537,RED RETROSPOT PUDDING BOWL
20996,JAZZ HEARTS ADDRESS BOOK
85200,BUNNY EGG BOX
21414,
22222,CAKE PLATE LOVEBIRD WHITE
90212C,PURPLE LAS VEGAS BRACELET ROUND
22378,WALL TIDY RETROSPOT 
20893,HANGING BAUBLE T-LIGHT HOLDER SMALL
90034,WHITE SILVER NECKLACE SHELL GLASS
20840,FRENCH FLORAL CUSHION COVER 
22285,HANGING HEN ON NEST DECORATION
22916,HERB MARKER THYME
21357,TOAST ITS - DINOSAUR
17012D,ORIGAMI ROSE INCENSE/CANDLE SET 
82613c,"""METAL SIGN"
84247E,PACK/12 XMAS FUN CARD
22881,NUMBER TILE VINTAGE FONT 2
22360,GLASS JAR ENGLISH CONFECTIONERY
15044B,BLUE PAPER PARASOL 
16046,TEATIME PEN CASE & PENS
22469,HEART OF WICKER SMALL
84660b,BLACK STITCHED WALL CLOCK
21722,SWEET PUDDING STICKER SHEET
16008,SMALL FOLDING SCISSOR(POINTED EDGE)
84969,BOX OF 6 ASSORTED COLOUR TEASPOONS
21430,SET/3 RED GINGHAM ROSE STORAGE BOX
21974,SET OF 36 PAISLEY FLOWER DOILIES
20914,SET/5 RED SPOTTY LID GLASS BOWLS
21661,
22734,
22662,LUNCH BAG DOLLY GIRL DESIGN
22765,NEWSPAPER STAND
46776D,WOVEN SUNSET CUSHION COVER 
21833,CAMOUFLAGE LED TORCH
22975,SPACEBOY CHILDRENS EGG CUP
35591T,TURQUOISE CHRISTMAS TREE 
21662,VINTAGE GLASS COFFEE CADDY
47369B,BLUE GREEN EMBROIDERY COSMETIC BAG
21367,MIRRORED WALL ART GENTS
21393,BLUE POLKADOT PUDDING BOWL
22758,LARGE PURPLE BABUSHKA NOTEBOOK  
22807,SET OF 6 T-LIGHTS TOADSTOOLS
21820,GLITTER HEART GARLAND WITH BELLS 
22331,WOODLAND PARTY BAG + STICKER SET
22099,CARAVAN SQUARE TISSUE BOX
21000,ROSE DU SUD COSMETICS BAG
35964,FOLKART CLIP ON STARS
22508,DOORSTOP RETROSPOT HEART
85068,CREAM SWEETHEART SHELF + HOOKS
85231G,ORANGE SCENTED SET/9 T-LIGHTS
22486,PLASMATRONIC LAMP
15056p,EDWARDIAN PARASOL PINK
21249,WOODLAND  HEIGHT CHART STICKERS 
21897,POTTING SHED CANDLE CITRONELLA
21147,JINGLE BELLS TREE DECORATION
22876,NUMBER TILE COTTAGE GARDEN 8
84806B,WHITE CANDYSTUFT ARTIFICIAL FLOWER
85230F,
85067,
84898F,YELLOW FLOWERS FELT HANDBAG KIT
21850,BLUE  DIAMANTE PEN IN GIFT BOX
84247N,PACK/12 BLUE FOLKART CARDS
35599D,PINK AND WHITE CHRISTMAS TREE 120CM
20770,ABSTRACT CIRCLE JOURNAL 
35471D,SET OF 3 BIRD LIGHT PINK FEATHER 
47420,ASSORTED COLOUR SUCTION CUP HOOK
85131C,BEADED CRYSTAL HEART BLUE ON STICK
37444C,PINK BREAKFAST CUP AND SAUCER 
85213,MINI  ZINC GARDEN DECORATIONS 
90114,SUMMER DAISIES BAG CHARM
21232,STRAWBERRY CERAMIC TRINKET BOX
79144C,PAINTED LIGHTBULB RAINBOW DESIGN
20974,12 PENCILS SMALL TUBE SKULL
20972,PINK CREAM FELT CRAFT TRINKET BOX 
35967,FOLK ART METAL STAR T-LIGHT HOLDER
79190A,RETRO PLASTIC 70'S TRAY
21352,EUCALYPTUS & PINECONE  WREATH
21711,FOLDING UMBRELLA WHITE/RED POLKADOT
35833P,4 PINK FLOCK CHRISTMAS BALLS
22359,GLASS JAR KINGS CHOICE
85049C,ROMANTIC PINKS RIBBONS 
90040B,MURANO STYLE GLASS BRACELET BLACK
22149,FELTCRAFT 6 FLOWER FRIENDS
85039a,SET/4 RED MINI ROSE CANDLE IN BOWL
22870,NUMBER TILE COTTAGE GARDEN 2
85036B,CHOCOLATE 1 WICK MORRIS BOX CANDLE
47567B,TEA TIME KITCHEN APRON
22433,WATERING CAN GREEN DINOSAUR
84247L,FAWN AND MUSHROOM GREETING CARD
85123A,WHITE HANGING HEART T-LIGHT HOLDER
35004P,
21446,12 RED ROSE PEG PLACE SETTINGS
22040,BOTANICAL ROSE GIFT WRAP
90033,IVORY SHELL HEART EARRINGS
72803b,OCEAN SCENT CANDLE JEWELLED DRAWER
21167,WHITE SAGE INCENSE
21122,SET/10 PINK POLKADOT PARTY CANDLES
84927D,LA PALMIERA TILE HOOK
71215,METAL BASE FOR CANDLES
90059E,DIAMANTE HAIR GRIP PACK/2 RUBY
22083,PAPER CHAIN KIT RETROSPOT
22667,RECIPE BOX RETROSPOT 
22763,KEY CABINET MA CAMPAGNE
22297,HEART IVORY TRELLIS SMALL
84931B,BLUE SCOTTIE DOG W FLOWER PATTERN
84313B,BLUE TV TRAY TABLE 
46118,FUNKY MONKEY CUSHION COVER
84562A,
22600,CHRISTMAS RETROSPOT STAR WOOD
21892,TRADITIONAL WOODEN CATCH CUP GAME 
84874B,BLUE TRAVEL FIRST AID KIT
22324,BLUE POLKADOT KIDS BAG
22268,EASTER DECORATION SITTING BUNNY
75049L,LARGE CIRCULAR MIRROR MOBILE
46000S,Dotcom
22228,BUNNY WOODEN PAINTED WITH BIRD 
21720,CAKE SHOP  STICKER SHEET
47348A,FUSCHIA VOILE POINTY SHOE DEC
79191D,RETRO PLASTIC DAISY TRAY
21578,WOODLAND DESIGN  COTTON TOTE BAG
37448,CERAMIC CAKE DESIGN SPOTTED MUG
22356,CHARLOTTE BAG PINK POLKADOT
22246,MAGIC GARDEN FELT GARLAND 
22334,DINOSAUR PARTY BAG + STICKER SET
22634,CHILDS BREAKFAST SET SPACEBOY 
22201,FRYING PAN BLUE POLKADOT
22664,TOY TIDY DOLLY GIRL DESIGN
84360,TABLE LAMP WHITE SHADE WOOD BASE
22474,SPACEBOY TV DINNER TRAY
22557,PLASTERS IN TIN VINTAGE PAISLEY 
22575,METAL MERRY CHRISTMAS WREATH
84944,SET OF 6 KASHMIR FOLKART BAUBLES
22444,
22865,HAND WARMER OWL DESIGN
20793,BLUE TILED TRAY
85230A,OPIUM SCENTED VOTIVE CANDLE
22833,
20697,LITTLE GREEN MONSTER SOFT TOY
21519,GIN & TONIC DIET GREETING CARD 
21061,PARTY INVITES FOOTBALL
22376,AIRLINE BAG VINTAGE JET SET WHITE
90032,IVORY SHELL HEART NECKLACE
22349,DOG BOWL CHASING BALL DESIGN
21356,TOAST ITS - FAIRY FLOWER
84859A,SILVER DISCO HANDBAG
23166,MEDIUM CERAMIC TOP STORAGE JAR
35972,DAISY FOLKART HEART DECORATION
85161,ACRYLIC GEOMETRIC LAMP
47585A,PINK FAIRY CAKE CUSHION COVER
22887,NUMBER TILE VINTAGE FONT 8
15056BL,EDWARDIAN PARASOL BLACK
21381,MINI WOODEN HAPPY BIRTHDAY GARLAND
21683,MEDIUM MEDINA STAMPED METAL BOWL 
22695,WICKER WREATH SMALL
22497,SET OF 2 TINS VINTAGE BATHROOM 
22033,BOTANICAL ROSE GREETING CARD
85064,
44091A,BLUE CRUSOE CHECK LAMPSHADE
22470,HEART OF WICKER LARGE
85212,MINI PAINTED GARDEN DECORATION 
21431,
84997d,PINK 3 PIECE POLKADOT CUTLERY SET
47518F,ICON PLACEMAT POP ART ELVIS
20950,
21749,LARGE RED RETROSPOT WINDMILL
21187,WHITE BELL HONEYCOMB PAPER GARLAND 
21881,CUTE CATS TAPE
84947,ANTIQUE SILVER TEA GLASS ENGRAVED
22915,ASSORTED BOTTLE TOP  MAGNETS 
84872a,TEATIME FUNKY FLOWER BACKPACK FOR 2
90120B,BLUE MURANO TWIST BRACELET
22922,FRIDGE MAGNETS US DINER ASSORTED
22827,RUSTIC  SEVENTEEN DRAWER SIDEBOARD
21051,RIBBONS PURSE 
22129,PARTY CONES CANDY TREE DECORATION
35809a,ENAMEL PINK TEA CONTAINER
22418,10 COLOUR SPACEBOY PEN
90210C,RED   ACRYLIC FACETED BANGLE
17084N,FAIRY DREAMS INCENSE 
21199,PINK  HEART CONFETTI IN TUBE
84457,SET/3 RABBITS FLOWER SKIPPPING ROPE
20669,RED HEART LUGGAGE TAG
47559b,TEA TIME OVEN GLOVE
22788,BROCANTE COAT RACK
90200B,BLACK SWEETHEART BRACELET
90051,CRACKED GLAZE NECKLACE RED
22716,CARD CIRCUS PARADE
82615,PINK MARSHMALLOW SCARF KNITTING KIT
20781,GOLD EAR MUFF HEADPHONES
46776A,WOVEN BUBBLE GUM CUSHION COVER
22103,MIRROR MOSAIC T-LIGHT HOLDER ROUND
84029E,
22579,WOODEN TREE CHRISTMAS SCANDINAVIAN
84799,SPRIG LAVENDER ARTIFICIAL FLOWER
21166,COOK WITH WINE METAL SIGN 
22137,BATHROOM SET LOVE HEART DESIGN
22894,TABLECLOTH RED APPLES DESIGN 
85049D,BRIGHT BLUES RIBBONS 
21333,CLASSIC WHITE FRAME
22774,RED DRAWER KNOB ACRYLIC EDWARDIAN
21931,JUMBO STORAGE BAG SUKI
22848,BREAD BIN DINER STYLE PINK
21935,SUKI  SHOULDER BAG
85126,
21251,DINOSAUR HEIGHT CHART STICKER SET
22528,GARDENERS KNEELING PAD
84968A,SET OF 16 VINTAGE ROSE CUTLERY
22688,DOORMAT PEACE ON EARTH BLUE
22541,MINI JIGSAW LEAP FROG
90019A,SILVER M.O.P ORBIT BRACELET
22705,WRAP GREEN PEARS 
84032B,CHARLIE + LOLA RED HOT WATER BOTTLE
21208,PASTEL COLOUR HONEYCOMB FAN
22128,PARTY CONES CANDY ASSORTED
90011E,AMBER CRYSTAL DROP EARRINGS
21054,NURSE'S BAG SOFT TOY
22889,NUMBER TILE VINTAGE FONT No 
22399,MAGNETS PACK OF 4 CHILDHOOD MEMORY
22306,SILVER MUG BONE CHINA TREE OF LIFE
47574A,ENGLISH ROSE SCENTED HANGING FLOWER
84832,ZINC WILLIE WINKIE  CANDLE STICK
84813,SET OF 4 DIAMOND NAPKIN RINGS
21802,CHRISTMAS TREE HEART DECORATION
35817P,"""ACRYLIC JEWEL SNOWFLAKE"
85086A,CANDY SPOT HEART DECORATION
85189,HANGING BUTTERFLY  EGG
21704,BAG 250g SWIRLY MARBLES
22516,CHILDS GARDEN RAKE BLUE
21563,RED HEART SHAPE LOVE BUCKET 
21682,LARGE MEDINA STAMPED METAL BOWL 
90003E,GREEN PAIR HEART HAIR SLIDES
22352,LUNCH BOX WITH CUTLERY RETROSPOT 
22371,AIRLINE BAG VINTAGE TOKYO 78
21864,UNION JACK FLAG PASSPORT COVER 
22034,
22821,GIFT BAG PSYCHEDELIC APPLES
22748,POPPY'S PLAYHOUSE KITCHEN
85129C,BEADED CRYSTAL HEART BLUE SMALL
22536,MAGIC DRAWING SLATE PURDEY
22902,TOTE BAG I LOVE LONDON
22046,TEA PARTY  WRAPPING PAPER 
90167,
22500,SET OF 2 TINS JARDIN DE PROVENCE
20748,KENSINGTON COFFEE SET
85130B,BEADED CRYSTAL HEART GREEN LARGE
51008,AFGHAN SLIPPER SOCK PAIR
71403,"""PINK/WHITE """"KEEP CLEAN"""" BULLET BIN"""
22276,WASH BAG VINTAGE ROSE PAISLEY
20766,GARDEN PATH SKETCHBOOK
90036E,"""FLOWER GLASS GARLD NECKL36""""AMETHYST"""
22301,COFFEE MUG CAT + BIRD DESIGN
22362,GLASS JAR PEACOCK BATH SALTS
21014,SWISS CHALET TREE DECORATION 
21531,RED RETROSPOT SUGAR JAM BOWL
90199C,5 STRAND GLASS NECKLACE CRYSTAL
51020A,SUMMER FUN DESIGN SHOWER CAP
21399,BLUE POLKADOT COFFEE MUG
22513,DOORSTOP FOOTBALL DESIGN
22746,POPPY'S PLAYHOUSE LIVINGROOM 
22048,BIRTHDAY BANQUET GIFT WRAP
22670,FRENCH WC SIGN BLUE METAL
22540,MINI JIGSAW CIRCUS PARADE 
22131,FOOD CONTAINER SET 3 LOVE HEART 
37503,TEA TIME CAKE STAND IN GIFT BOX
22969,HOMEMADE JAM SCENTED CANDLES
21281,VINTAGE KITCHEN PRINT SEAFOOD
22345,PARTY PIZZA DISH BLUE POLKADOT
22769,CHALKBOARD KITCHEN ORGANISER
22809,SET OF 6 T-LIGHTS SANTA
85049E,SCANDINAVIAN REDS RIBBONS
21830,ASSORTED CREEPY CRAWLIES
22267,EASTER DECORATION EGG BUNNY 
21403,BLUE EGG  SPOON
22454,MEASURING TAPE BABUSHKA RED
21990,MODERN FLORAL STATIONERY SET
84508A,CAMOUFLAGE DESIGN TEDDY
21684,SMALL MEDINA STAMPED METAL BOWL 
17003,BROCADE RING PURSE 
22294,HEART FILIGREE DOVE  SMALL
84499,
20819,SILVER TEDDY BEAR
21648,ASSORTED TUTTI FRUTTI SMALL PURSE
21351,CINAMMON & ORANGE WREATH
22890,NOVELTY BISCUITS CAKE STAND 3 TIER
22928,YELLOW GIANT GARDEN THERMOMETER
85099F,JUMBO BAG STRAWBERRY
84879,ASSORTED COLOUR BIRD ORNAMENT
22073,RED RETROSPOT STORAGE JAR
90209B,GREEN ENAMEL+GLASS HAIR COMB
90214D,"""LETTER """"D"""" BLING KEY RING"""
22181,SNOWSTORM PHOTO FRAME FRIDGE MAGNET
22825,DECORATIVE PLANT POT WITH FRIEZE
22134,MINI LADLE LOVE HEART RED 
21914,BLUE HARMONICA IN BOX 
22736,RIBBON REEL MAKING SNOWMEN 
22620,4 TRADITIONAL SPINNING TOPS
22480,RED TEA TOWEL CLASSIC DESIGN
84968F,check
84800M,MEDIUM WHITE/PINK ROSE ART FLOWER
35957,
90214N,"""LETTER """"N"""" BLING KEY RING"""
21194,PINK  HONEYCOMB PAPER FAN
21689,SILVER VANILLA  FLOWER CANDLE POT
72709,IVORY SCULPTED RND CANDLE 
22811,SET OF 6 T-LIGHTS CACTI 
22236,CAKE STAND 3 TIER MAGIC GARDEN
21632,VINTAGE PINK DECORATIVE PARASOL
21738,COSY SLIPPER SHOES SMALL  RED 
21165,BEWARE OF THE CAT METAL SIGN 
21145,ANTIQUE GLASS PLACE SETTING
21332,MOROCCAN BEATEN METAL MIRROR
90129B,TURQUOISE GLASS TASSLE BAG CHARM 
90166,PINK & WHITE ROSEBUD RING
22229,BUNNY WOODEN PAINTED WITH FLOWER 
22659,LUNCH BOX I LOVE LONDON
20726,LUNCH BAG WOODLAND
22154,ANGEL DECORATION 3 BUTTONS 
85078,SCANDINAVIAN 3 HEARTS NAPKIN RING
22138,BAKING SET 9 PIECE RETROSPOT 
84251G,"""GREETING CARD"
21248,DOOR HANGER  MUM + DADS ROOM
35637A,IVORY STRING CURTAIN WITH POLE 
22520,CHILDS GARDEN TROWEL BLUE 
85144,JARDIN ETCHED GLASS BUTTER DISH
22427,ENAMEL FLOWER JUG CREAM
84251C,"""GREETING CARD"
21385,IVORY HANGING DECORATION  HEART
84012,MAGIC SHEEP WOOL GROWING FROM PAPER
22308,TEA COSY BLUE STRIPE
84341B,SMALL PINK MAGIC CHRISTMAS TREE
35610C,WHITE CHRISTMAS FLOCK DROPLET 
84712B,PINK JEWELLED PHOTO FRAME
20695,FLORAL BLUE MONSTER
21676,FLOWERS  STICKERS
79190D,RETRO PLASTIC DAISY TRAY
21144,PINK POODLE HANGING DECORATION 
17012E,ORIGAMI OPIUM INCENSE/CANDLE SET 
22580,ADVENT CALENDAR GINGHAM SACK
22063,CERAMIC BOWL WITH STRAWBERRY DESIGN
21973,SET OF 36 MUSHROOM PAPER DOILIES
21470,FLOWER VINE RAFFIA FOOD COVER
90214H,"""LETTER """"H"""" BLING KEY RING"""
90003B,ROSE COLOUR PAIR HEART HAIR SLIDES
22663,JUMBO BAG DOLLY GIRL DESIGN
84596E,SMALL LICORICE DES PINK BOWL
85106,CUT GLASS HEXAGON T-LIGHT HOLDER
84997A,GREEN 3 PIECE POLKADOT CUTLERY SET
90116,FRUIT SALAD BAG CHARM
21363,HOME SMALL WOOD LETTERS
20716,PARTY FOOD SHOPPER BAG
20670,VIP HOLIDAY PURSE
21677,HEARTS  STICKERS
90019B,GOLD M.O.P ORBIT BRACELET
22974,CHILDRENS DOLLY GIRL MUG
21213,PACK OF 72 SKULL CAKE CASES
84228,HEN HOUSE W CHICK STANDING
22977,DOLLY GIRL CHILDRENS EGG CUP
21943,CAKES AND RABBITS DESIGN FLANNEL 
22411,JUMBO SHOPPER VINTAGE RED PAISLEY
84609,TALL ROCOCO CANDLE HOLDER
35912B,WHITE/PINK CHICK DECORATION
20723,STRAWBERRY CHARLOTTE BAG
22024,RAINY LADIES BIRTHDAY CARD
48188,DOORMAT WELCOME PUPPIES
22348,TEA BAG PLATE RED RETROSPOT
21747,SMALL SKULL WINDMILL
21801,
90180A,BLACK+WHITE NECKLACE W TASSEL
85071D,CHARLIE+LOLA MY ROOM DOOR SIGN
22718,CARD CAT AND TREE 
22886,NUMBER TILE VINTAGE FONT 7
85019C,CURIOUS  IMAGES NOTEBOOK SET
20818,GOLD TEDDY BEAR
90196A,PURPLE GEMSTONE NECKLACE 45CM
21401,BLUE PUDDING SPOON
22415,WHITE TISSUE REAM
22817,CARD SUKI BIRTHDAY
22835,HOT WATER BOTTLE I AM SO POORLY
22354,RETROSPOT PADDED SEAT CUSHION
85071A,BLUE CHARLIE+LOLA PERSONAL DOORSIGN
20762,GREEN FERN SKETCHBOOK 
21172,PARTY METAL SIGN 
90214Y,"""LETTER """"Y"""" BLING KEY RING"""
21785,RAIN PONCHO 
22340,NOEL GARLAND PAINTED ZINC 
22384,LUNCH BAG PINK POLKADOT
20775,DAISY NOTEBOOK 
84032A,CHARLIE+LOLA PINK HOT WATER BOTTLE
22964,3 PIECE SPACEBOY COOKIE CUTTER SET
90125A,PINK BERTIE GLASS BEAD BAG CHARM
22786,CUSHION COVER PINK UNION JACK
84870C,GREEN GEISHA GIRL 
21912,VINTAGE SNAKES & LADDERS
90059A,DIAMANTE HAIR GRIP PACK/2 CRYSTAL
21408,SPOTTY PINK DUCK DOORSTOP
84789,ENCHANTED BIRD PLANT CAGE
90158,ST TROPEZ NECKLACE
79160,HEART SHAPE WIRELESS DOORBELL
84462,3 PINK HEN+CHICKS IN BASKET
21319,GLASS CHALICE GREEN  SMALL 
84711A,SILVER OVAL SHAPE TRINKET BOX
22479,DAISY GARDEN MARKER
22034,ROBIN CHRISTMAS CARD
22259,FELT FARM ANIMAL HEN
35921,EASTER BUNNY HANGING GARLAND
20829,GLITTER HANGING BUTTERFLY STRING
84522,PINK PARTY SUNGLASSES
21067,VINTAGE RED TEATIME MUG
84279P,CHERRY BLOSSOM  DECORATIVE FLASK
21769,VINTAGE POST OFFICE CABINET
22196,SMALL HEART MEASURING SPOONS
85042,ANTIQUE LILY FAIRY LIGHTS
21692,
90162B,ANT SILVER LIME GREEN BOUDICCA RING
22139,amazon
21891,TRADITIONAL WOODEN SKIPPING ROPE
DCGS0070,CAMOUFLAGE DOG COLLAR
21471,STRAWBERRY RAFFIA FOOD COVER
35915C,PEACH KNITTED HEN 
11001,ASSTD DESIGN RACING CAR PEN
21205,MULTICOLOUR 3D BALLS GARLAND
22869,NUMBER TILE COTTAGE GARDEN 1
21692,SILVER LATTICE VANILLA CANDLE POT
84884a,ANT WHITE WIRE HEART SPIRAL
84050,PINK HEART SHAPE EGG FRYING PAN
85053,FRENCH ENAMEL CANDLEHOLDER
35651,VINTAGE BEAD PINK SCARF 
20657,TROPICAL LUGGAGE TAG
84745B,BLUE HANGING GINGHAM EASTER HEN
21001,ROSE DU SUD WASHBAG 
22745,POPPY'S PLAYHOUSE BEDROOM 
gift_0001_50,Dotcomgiftshop Gift Voucher £50.00
21915,RED  HARMONICA IN BOX 
22719,GUMBALL MONOCHROME COAT RACK
84531B,BLUE KNITTED EGG COSY
21991,BOHEMIAN COLLAGE STATIONERY SET
21890,S/6 WOODEN SKITTLES IN COTTON BAG
84406B,CREAM CUPID HEARTS COAT HANGER
84846A,SCENTED CANDLE IN DIGITALIS TIN
90151,SILVER/NATURAL SHELL NECKLACE
21755,LOVE BUILDING BLOCK WORD
90147,CHUNKY SILVER NECKLACE PASTEL FLOWE
90190C,SILVER/AMETHYST DROP EARRINGS LEAF
22678,FRENCH BLUE METAL DOOR SIGN 3
22885,NUMBER TILE VINTAGE FONT 6 
22768,FAMILY PHOTO FRAME CORNICE
90011A,MIDNIGHT BLUE CRYSTAL DROP EARRINGS
22926,IVORY GIANT GARDEN THERMOMETER
22960,JAM MAKING SET WITH JARS
22574,HEART WOODEN CHRISTMAS DECORATION
21155,RED RETROSPOT PEG BAG
22247,BUNNY DECORATION MAGIC GARDEN
90185C,BLACK DIAMANTE EXPANDABLE RING
79067,CORONA MEXICAN TRAY
47480,HANGING PHOTO CLIP ROPE LADDER
84192,ASSORTED COLOUR METAL CAT 
22047,EMPIRE GIFT WRAP
84823,DANISH ROSE FOLDING CHAIR
22644,CERAMIC CHERRY CAKE MONEY BANK
85170A,
35958,
46776F,WOVEN ROSE GARDEN CUSHION COVER 
21706,FOLDING UMBRELLA RED/WHITE POLKADOT
22325,MOBILE VINTAGE HEARTS 
21595,Dad's Cab Electronic Meter
35265,COLOURFUL FLOWER FRUIT BOWL
22777,GLASS CLOCHE LARGE
82552,WASHROOM METAL SIGN
20934,SET/3 POT PLANT CANDLES
22766,PHOTO FRAME CORNICE
20757,RED DAISY POCKET BOOK 
21696,SMALL SILVER TRELLIS CANDLEPOT
22438,BALLOON ART MAKE YOUR OWN FLOWERS
84798A,PINK FOXGLOVE ARTIIFCIAL FLOWER
35958,FOLKART ZINC STAR CHRISTMAS DEC
90208,PAIR OF PINK FLOWER CLUSTER SLIDE
20932,PINK POT PLANT CANDLE
90018A,SILVER M.O.P ORBIT DROP EARRINGS
21700,BIG DOUGHNUT FRIDGE MAGNETS
15034,PAPER POCKET TRAVELING FAN 
85066,CREAM SWEETHEART MINI CHEST
22899,CHILDREN'S APRON DOLLY GIRL 
20897,VINTAGE NOTEBOOK PARIS DAYS
84707A,SILVER JEWELLED MIRROR TRINKET TRAY
85215,ASSORTED CHEESE FRIDGE MAGNETS
m,Manual
22777,GLASS BELL JAR LARGE
84508B,STRIPES DESIGN TEDDY
20763,DAISY SKETCHBOOK 
22593,CHRISTMAS GINGHAM STAR
85039B,S/4 IVORY MINI ROSE CANDLE IN BOWL
22321,BIRD DECORATION RED RETROSPOT
84509E,SET OF 4 CAROUSEL PLACEMATS 
17038,PORCELAIN BUDAH INCENSE HOLDER
85135B,
22614,PACK OF 12 SPACEBOY TISSUES
46000M,Dotcom sales
21618,4 WILDFLOWER BOTANICAL CANDLES
16169K,WRAP FOLK ART
21484,CHICK GREY HOT WATER BOTTLE
22583,PACK OF 6 HANDBAG GIFT BOXES
22538,MINI JIGSAW GO TO THE FAIR
22266,EASTER DECORATION HANGING BUNNY
22772,PINK DRAWER KNOB ACRYLIC EDWARDIAN
21426,WOODLAND STORAGE BOX SMALL
22799,SWEETHEART WIRE FRUIT BOWL
84773,RED ROSE AND LACE C/COVER
22191,IVORY DINER WALL CLOCK
22082,RIBBON REEL STRIPES DESIGN 
22783,SET 3 WICKER OVAL BASKETS W LIDS
78034B,BLUE NETTING STORAGE HANGER
16048,TEATIME ROUND PENCIL SHARPENER 
21275,ZINC TOP  2 DOOR WOODEN SHELF 
21763,
22530,MAGIC DRAWING SLATE DOLLY GIRL 
22309,TEA COSY RED  STRIPE
85064,CREAM SWEETHEART LETTER RACK
62096A,PINK/YELLOW FLOWERS HANDBAG
21942,SKULLS DESIGN FLANNEL
35965,FOLKART HEART NAPKIN RINGS
22751,FELTCRAFT PRINCESS OLIVIA DOLL
35951,
84459A,PINK METAL CHICKEN HEART 
20801,LARGE PINK GLASS SUNDAE DISH
22526,WHEELBARROW FOR CHILDREN 
22837,HOT WATER BOTTLE BABUSHKA LARGE
22233,JIGSAW RABBIT AND BIRDHOUSE
21011,
85114A,BLACK ENCHANTED FOREST PLACEMAT
22847,"""BREAD BIN"
22791,T-LIGHT GLASS FLUTED ANTIQUE
22871,NUMBER TILE COTTAGE GARDEN 3 
22031,BOTANICAL LAVENDER BIRTHDAY CARD
90037C,TINY CRYSTAL BRACELET BLUE
22391,PAPERWEIGHT HOME SWEET HOME
20700,GREEN CAT FLORAL CUSHION COVER 
84077,WORLD WAR 2 GLIDERS ASSTD DESIGNS
20684,
22353,
22841,ROUND CAKE TIN VINTAGE GREEN
21410,COUNTRY COTTAGE  DOORSTOP GREEN
22398,MAGNETS PACK OF 4 SWALLOWS
79163,BLACK CHAMPAGNE GLASS
21913,VINTAGE SEASIDE JIGSAW PUZZLES
21524,DOORMAT SPOTTY HOME SWEET HOME
22437,SET OF 9 BLACK SKULL BALLOONS
84854,GIRLY PINK TOOL SET
22145,CHRISTMAS CRAFT HEART STOCKING 
21200,MULTICOLOUR HONEYCOMB PAPER GARLAND
85186A,EASTER BUNNY GARLAND OF FLOWERS
21867,PINK UNION JACK  LUGGAGE TAG
22534,MAGIC DRAWING SLATE SPACEBOY 
22828,REGENCY MIRROR WITH SHUTTERS
20652,BLUE POLKADOT LUGGAGE TAG 
85152,HAND OVER THE CHOCOLATE   SIGN 
85230B,CINNAMON SCENTED VOTIVE CANDLE
85031B,BLOSSOM IMAGES SCRAP BOOK SET
22863,SOAP DISH BROCANTE
22511,RETROSPOT BABUSHKA DOORSTOP
15044C,PURPLE PAPER PARASOL
47563A,RETRO LONGBOARD IRONING BOARD COVER
21980,PACK OF 12 RED RETROSPOT TISSUES 
22564,ALPHABET STENCIL CRAFT
16162L,THE KING GIFT BAG
84029G,KNITTED UNION FLAG HOT WATER BOTTLE
22604,SET OF 4 NAPKIN CHARMS CUTLERY
22215,CAKE STAND WHITE TWO TIER LACE
21491,SET OF THREE VINTAGE GIFT WRAPS
21976,PACK OF 60 MUSHROOM CAKE CASES
37462E,"""PET MUG"
37340,MULTICOLOUR SPRING FLOWER MUG
22065,CHRISTMAS PUDDING TRINKET POT 
20731,POSY CANDY BAG
22727,ALARM CLOCK BAKELIKE RED 
48116,DOORMAT MULTICOLOUR STRIPE
22519,CHILDS GARDEN BRUSH PINK
22035,VINTAGE CARAVAN GREETING CARD 
21494,ROTATING LEAVES T-LIGHT HOLDER
21117,BLOND DOLL DOORSTOP
22165,"""DIAMANTE HEART SHAPED WALL MIRROR"
72807A,SET/3 ROSE CANDLE IN JEWELLED BOX
90040A,MURANO STYLE GLASS BRACELET RED
85040B,SET/4 BLUE FLOWER CANDLES IN BOWL
85180A,RED HEARTS LIGHT CHAIN 
22456,NATURAL SLATE CHALKBOARD LARGE 
21644,ASSORTED TUTTI FRUTTI HEART BOX
22559,SEASIDE FLYING DISC
84218,BOX/12 CHICK & EGG IN BASKET
21929,JUMBO BAG PINK VINTAGE PAISLEY
22021,BLUE FELT EASTER EGG BASKET
22780,LIGHT GARLAND BUTTERFILES PINK
22393,PAPERWEIGHT VINTAGE COLLAGE
90214I,"""LETTER """"I"""" BLING KEY RING"""
20724,RED RETROSPOT CHARLOTTE BAG
22452,MEASURING TAPE BABUSHKA PINK
22532,MAGIC DRAWING SLATE LEAP FROG 
84212,"""ASSORTED FLOWER COLOUR """"LEIS"""""""
84562A,PINK/WHITE RIBBED MELAMINE JUG
21411,GINGHAM HEART  DOORSTOP RED
10124A,SPOTS ON RED BOOKCOVER TAPE
85186C,BUNNY EGG GARLAND
22380,TOY TIDY SPACEBOY  
22820,GIFT BAG BIRTHDAY
22611,VINTAGE UNION JACK SHOPPING BAG
22069,BROWN  PIRATE TREASURE CHEST 
21629,SQUARE FLOOR CUSHION VINTAGE RED
85169D,PINK LOVE BIRD CANDLE
90104,PURPLE FRANGIPANI HAIRCLIP
16207A,PINK STRAWBERRY HANDBAG 
21318,GLASS CHALICE BLUE SMALL 
85017B,ENVELOPE 50 BLOSSOM IMAGES
90082D,DIAMANTE BOW BROOCH BLACK COLOUR
90010A,MIDNIGHT BLUE GLASS/SILVER BRACELET
22698,PINK REGENCY TEACUP AND SAUCER
16216,LETTER SHAPE PENCIL SHARPENER
90191,SILVER LARIAT 40CM
84509c,SET OF 4 POLKADOT PLACEMATS 
22157,ANGEL DECORATION WITH LACE PADDED
21744,SNOWFLAKE PORTABLE TABLE LIGHT 
22336,DOVE DECORATION PAINTED ZINC 
22209,WOOD STAMP SET HAPPY BIRTHDAY
22214,CANDLE PLATE LACE WHITE
22866,HAND WARMER SCOTTY DOG DESIGN
22792,FLUTED ANTIQUE CANDLE HOLDER
21186,WHITE DOVE HONEYCOMB PAPER GARLAND
84509G,SET OF 4 FAIRY CAKE PLACEMATS 
22407,MONEY BOX FIRST ADE DESIGN
71459,HANGING JAM JAR T-LIGHT HOLDER
22043,CHRISTMAS CARD SCREEN PRINT 
84497,BUTTONS AND STRIPES NOTEBOOK 
20684,STRAWBERRY DREAM CHILDS UMBRELLA
37489C,GREEN/BLUE FLOWER DESIGN BIG MUG
DCGS0076,SUNJAR LED NIGHT NIGHT LIGHT
22882,NUMBER TILE VINTAGE FONT 3
90161A,ANT COPPER RED BOUDICCA BRACELET
22025,RING OF ROSES BIRTHDAY CARD
22175,PINK OWL SOFT TOY
DOT,DOTCOM POSTAGE
84596J,MIXED NUTS LIGHT GREEN BOWL
84620,BLUE GINGHAM ROSE CUSHION COVER
15056bl,EDWARDIAN PARASOL BLACK
84531A,PINK KNITTED EGG COSY
20803,SMALL PINK GLASS SUNDAE DISH
22741,FUNKY DIVA PEN
21084,SET/6 COLLAGE PAPER CUPS
72801C,4 ROSE PINK DINNER CANDLES
22684,FRENCH BLUE METAL DOOR SIGN 9
16014,SMALL CHINESE STYLE SCISSOR
21786,POLKADOT RAIN HAT 
85176,SEWING SUSAN 21 NEEDLE SET
21882,SKULLS TAPE
22162,
85204,HANGING WOOD AND FELT FLOWER
84927A,WAKE UP COCKEREL TILE HOOK
85135B,BLUE DRAGONFLY HELICOPTER
22744,MAKE YOUR OWN MONSOON CARD KIT
22847,BREAD BIN DINER STYLE IVORY
20794,BLUE  TILE HOOK
85049A,TRADITIONAL CHRISTMAS RIBBONS
84856L,LARGE TAHITI BEACH BAG
22337,ANGEL DECORATION PAINTED ZINC 
75011,BLUE DAISY MOBILE
90011D,PURPLE CRYSTAL DROP EARRINGS
21486,
84968E,check
85132A,CHARLIE + LOLA BISCUITS TINS
85018D,YULETIDE IMAGES S/6 PAPER BOXES
22702,BLACK AND WHITE CAT BOWL
37476,CONDIMENT TRAY 4 BOWLS AND 4 SPOONS
90185B,AMETHYST DIAMANTE EXPANDABLE RING
15056N,EDWARDIAN PARASOL NATURAL
47566,PARTY BUNTING
21425,SKULLS STORAGE BOX LARGE
17014A,ORIGAMI VANILLA INCENSE CONES
22650,CERAMIC PIRATE CHEST MONEY BANK
37476,
21285,RETROSPOT CANDLE  MEDIUM
21647,ASSORTED TUTTI FRUTTI LARGE PURSE
22216,T-LIGHT HOLDER WHITE LACE
22937,BAKING MOULD CHOCOLATE CUPCAKES
21370,MIRRORED WALL ART FOXY
17091A,
90183B,AMETHYST DROP EARRINGS W LONG BEADS
21078,SET/20 STRAWBERRY PAPER NAPKINS 
85114c,RED ENCHANTED FOREST PLACEMAT
