22674,FRENCH TOILET SIGN BLUE METAL
90196B,BLACK GEMSTONE NECKLACE 45CM
21009,
90161B,ANT COPPER TURQ BOUDICCA BRACELET
84510E,SET OF 4 GREEN CAROUSEL COASTERS
84773,
21651,
22207,FRYING PAN UNION FLAG
20653,CHERRY BLOSSOM LUGGAGE TAG
22287,"""DECORATION "
21375,LARGE CAMPHOR WOOD FIELD MUSHROOM 
85035A,GARDENIA 3 WICK MORRIS BOXED CANDLE
21672,WHITE SPOT RED CERAMIC DRAWER KNOB
90137,PINK COMBO MINI CRYSTALS NECKLACE
90214V,"""LETTER """"V"""" BLING KEY RING"""
51014A,"""FEATHER PEN"
35004B,SET OF 3 BLACK FLYING DUCKS
20867,PINK ROSE FABRIC MIRROR
90125D,PURPLE BERTIE GLASS BEAD BAG CHARM
90081C,LILY BROOCH OLIVE COLOUR
90190A,SILVER/CRYSTAL DROP EARRINGS W LEAF
22284,HEN HOUSE DECORATION
22944,CHRISTMAS METAL POSTCARD WITH BELLS
22350,ILLUSTRATED CAT BOWL 
85167B,
35922,EASTER BUNNY WREATH
22804,CANDLEHOLDER PINK HANGING HEART
22647,CERAMIC LOVE HEART MONEY BANK
84596e,SMALL LICORICE DES PINK BOWL
84963A,PINK PAINTED KASHMIRI CHAIR
15056n,EDWARDIAN PARASOL NATURAL
90210D,PURPLE ACRYLIC FACETED BANGLE
85199S,SMALL HANGING IVORY/RED WOOD BIRD
21445,12 PINK ROSE PEG PLACE SETTINGS
85031A,ROMANTIC IMAGES SCRAP BOOK SET
22068,BLACK PIRATE TREASURE CHEST
22554,PLASTERS IN TIN WOODLAND ANIMALS
21930,JUMBO STORAGE BAG SKULLS
S,SAMPLES
84231,EASTER BUNNY WITH BASKET ON BACK
90190B,GOLD/AMBER DROP EARRINGS W LEAF
22761,CHEST 7 DRAWER MA CAMPAGNE
22420,LIPSTICK PEN BABY PINK
22868,NUMBER TILE COTTAGE GARDEN 0 
90125C,TURQUOISE BERTIE GLASS BEAD CHARM
22951,60 CAKE CASES DOLLY GIRL DESIGN
22539,MINI JIGSAW DOLLY GIRL
21927,BLUE/CREAM STRIPE CUSHION COVER 
20618,QUEEN OF THE SKIES PASSPORT COVER 
37327,ASSTD MULTICOLOUR CIRCLES MUG
22097,SWALLOW SQUARE TISSUE BOX
90142D,MOP PENDANT SHELL NECKLACE
21880,RED RETROSPOT TAPE
22546,MINI JIGSAW PURDEY
21421,PORCELAIN ROSE LARGE 
20983,12 PENCILS TALL TUBE RED RETROSPOT
21068,VINTAGE BILLBOARD LOVE/HATE MUG
22693,GROW A FLYTRAP OR SUNFLOWER IN TIN
22543,MINI JIGSAW BAKE A CAKE 
21673,WHITE SPOT BLUE CERAMIC DRAWER KNOB
90036D,"""FLOWER GLASS GARLAND NECKL.36""""BLACK"""
22598,CHRISTMAS MUSICAL ZINC TREE
22105,MIRROR MOSAIC GOBLET CANDLE HOLDER
22986,GINGHAM ROSE WRAP
21242,RED RETROSPOT PLATE 
47559B,TEA TIME OVEN GLOVE
22412,METAL SIGN NEIGHBOURHOOD WITCH 
22076,6 RIBBONS EMPIRE  
17021,NAMASTE SWAGAT INCENSE
20748,Found
21539,RED RETROSPOT BUTTER DISH
84685,BEACH HUT KEY CABINET
22104,MIRROR MOSAIC CANDLE PLATE
21709,FOLDING UMBRELLA CHOCOLATE POLKADOT
22673,FRENCH GARDEN SIGN BLUE METAL
20892,
21654,RIDGED GLASS FINGER BOWL
POST,
47471,RAINBOW PEGS PHOTO CLIP STRING
21845,DAIRY MAID STRIPE MUG
17091A,LAVENDER INCENSE IN TIN
90038A,GLASS AND PAINTED BEADS BRACELET TO
90028,NEW BAROQUE LARGE NECKLACE BLK/WHIT
21112,"""SWISS ROLL TOWEL"
20956,?
21678,PAISLEY PATTERN  STICKERS
22917,HERB MARKER ROSEMARY
21250,SET OF SKULL WALL STICKERS
21801,CHRISTMAS TREE DECORATION WITH BELL
85084,HOLLY TOP CHRISTMAS STOCKING
22627,MINT KITCHEN SCALES
22642,SET OF 4 NAPKIN CHARMS STARS   
22983,CARD BILLBOARD FONT
35597B,BLACKCHRISTMAS TREE 30CM
22936,BAKING MOULD ROSE WHITE CHOCOLATE
90027B,GLASS BEAD HOOP EARRINGS MONTANA
35004G,SET OF 3 GOLD FLYING DUCKS
84804A,CREAM DELPHINIUM ARTIFICIAL FLOWER
21851,LILAC DIAMANTE PEN IN GIFT BOX
47593B,SCOTTIE DOGS BABY BIB
81950V,FLOWER PURPLE CLOCK W/SUCKER
22603,CHRISTMAS RETROSPOT TREE WOOD
85175,CACTI T-LIGHT CANDLES
22476,EMPIRE UNION JACK TV DINNER TRAY
22478,BIRDHOUSE GARDEN MARKER 
21630,FLOOR CUSHION ELEPHANT CARNIVAL
22139,
22304,COFFEE MUG BLUE PAISLEY DESIGN
84660c,PINK STITCHED WALL CLOCK
22488,NATURAL SLATE RECTANGLE CHALKBOARD
21390,FILIGRIS HEART WITH BUTTERFLY
21829,DINOSAUR KEYRINGS ASSORTED
35001W,HAND OPEN SHAPE DECO.WHITE
21707,FOLDING UMBRELLA BLACKBLUE POLKADOT
90205C,LARGE CRYSTAL DIAMANTE HAIRSLIDE
20966,
72807B,SET/3 OCEAN SCENT CANDLE JEWEL BOX
20778,GARDEN PATH NOTEBOOK 
47421,ASSORTED COLOUR LIZARD SUCTION HOOK
35598B,BLACK CHRISTMAS TREE 60CM
22323,PINK POLKADOT KIDS BAG
22232,JIGSAW TOADSTOOLS 3 PIECE
22858,EASTER TIN KEEPSAKE
21491,
85197,SET OF 12 MINI BUNNIES IN A BUCKET
21348,PINK SPOTS CHOCOLATE NESTING BOXES 
22440,BALLOON WATER BOMB PACK OF 35
16207B,PINK HEART RED HANDBAG
22485,SET OF 2 WOODEN MARKET CRATES
22272,FELTCRAFT DOLL MARIA
21422,PORCELAIN ROSE SMALL
21136,PAINTED METAL PEARS ASSORTED
85132B,CHARLIE AND LOLA TABLE TINS
47422,ASSORTED MONKEY SUCTION CUP HOOK
21807,
85118,HEART T-LIGHT HOLDER
20617,FIRST CLASS PASSPORT COVER 
22585,PACK OF 6 BIRDY GIFT TAGS
90056,CHUNKY CRACKED GLAZE NECKLACE IVORY
22873,NUMBER TILE COTTAGE GARDEN 5
37450,CERAMIC CAKE BOWL + HANGING CAKES
22382,LUNCH BAG SPACEBOY DESIGN 
85040A,S/4 PINK FLOWER CANDLES IN BOWL
20986,BLUE CALCULATOR RULER
21116,OWL DOORSTOP
22113,GREY HEART HOT WATER BOTTLE
20848,ZINC HEART LATTICE CHARGER SMALL
21983,PACK OF 12 BLUE PAISLEY TISSUES 
22077,6 RIBBONS RUSTIC CHARM
85015,SET OF 12  VINTAGE POSTCARD SET
85045,GREEN CHRISTMAS TREE STRING 20LIGHT
21907,I'M ON HOLIDAY METAL SIGN
22855,FINE WICKER HEART 
90024C,NEW BAROQUE B'FLY NECKLACE GREEN
22512,DOORSTOP RACING CAR DESIGN
21311,SET/4 BIRD MIRROR MAGNETS 
22555,PLASTERS IN TIN STRONGMAN
21027,NINJA RABBIT PINK
22843,BISCUIT TIN VINTAGE GREEN
85179C,PINK BITTY LIGHT CHAIN
85019B,BLOSSOM  IMAGES NOTEBOOK SET
84763,ZINC FINISH 15CM PLANTER POTS
21179,NO JUNK MAIL METAL SIGN
20773,BLUE PAISLEY NOTEBOOK
85131D,BEADED CRYSTAL HEART PINK ON STICK
84796a,PINK HAWAIIAN PICNIC HAMPER FOR 2
21955,DOORMAT UNION JACK GUNS AND ROSES
22757,LARGE RED BABUSHKA NOTEBOOK 
21695,SMALL SILVER FLOWER CANDLE POT
20765,CHRYSANTHEMUM SKETCHBOOK 
22676,FRENCH BLUE METAL DOOR SIGN 1
22615,PACK OF 12 CIRCUS PARADE TISSUES 
21455,PAINTED YELLOW WOODEN DAISY
22192,BLUE DINER WALL CLOCK
22327,ROUND SNACK BOXES SET OF 4 SKULLS
71496A,A4 WALL TIDY BLUE OFFICE
22637,PIGGY BANK RETROSPOT 
22856,ASSORTED EASTER DECORATIONS  BELLS
22066,LOVE HEART TRINKET POT
90142A,GREEN PENDANT SHELL NECKLACE
22042,CHRISTMAS CARD SINGING ANGEL
20749,ASSORTED COLOUR MINI CASES
21918,SET 12 KIDS COLOUR  CHALK STICKS
84596b,SMALL DOLLY MIX DESIGN ORANGE BOWL
21903,MAN FLU METAL SIGN
22628,PICNIC BOXES SET OF 3 RETROSPOT 
85129B,BEADED CRYSTAL HEART GREEN SMALL
37482P,CUBIC MUG PINK POLKADOT
21043,APRON MODERN VINTAGE COTTON
22507,MEMO BOARD RETROSPOT  DESIGN
21202,DOLLY HONEYCOMB GARLAND
46115B,GREEN POP ART MAO CUSHION COVER 
84519B,CARROT CHARLIE+LOLA COASTER SET
22549,PICTURE DOMINOES
22280,POCKET BAG PINK PAISELY BROWN SPOT
90174,BUTTERFLY HAIR BAND
21816,CHRISTMAS TREE T-LIGHT HOLDER
90165A,PINK ROSEBUD PEARL EARRINGS
22231,JIGSAW TREE WITH BIRDHOUSE
84976,RECTANGULAR SHAPED MIRROR
90214F,"""LETTER """"F"""" BLING KEY RING"""
22681,FRENCH BLUE METAL DOOR SIGN 6
20676,RED RETROSPOT BOWL
21904,HOUSE WRECKING METAL SIGN 
85036b,CHOCOLATE 1 WICK MORRIS BOX CANDLE
22120,WELCOME  WOODEN BLOCK LETTERS
90018B,GOLD M.O.P ORBIT DROP EARRINGS
22645,CERAMIC HEART FAIRY CAKE MONEY BANK
85049H,URBAN BLACK RIBBONS 
84247G,"""DECOUPAGE"
84946,ANTIQUE SILVER TEA GLASS ETCHED
21609,SET 12 LAVENDER  BOTANICAL T-LIGHTS
85168B,BLACK BAROQUE CARRIAGE CLOCK
37461,FUNKY MONKEY MUG
20903,VINTAGE KEEPSAKE BOX TRAVELOGUE
84534B,
20846,ZINC HEART LATTICE T-LIGHT HOLDER
22953,BIRTHDAY BANNER TAPE
21287,SCENTED VELVET LOUNGE CANDLE 
22759,SET OF 3 NOTEBOOKS IN PARCEL
47481,50CM METAL STRING WITH  7 CLIPS
22264,FELT FARM ANIMAL WHITE BUNNY 
82483,WOOD 2 DRAWER CABINET WHITE FINISH
90162C,ANT SILVER FUSCHIA BOUDICCA RING
84592,CROCHET ROSE PURSE WITH SUEDE BACK
10002,INFLATABLE POLITICAL GLOBE 
21106,CREAM SLICE FLANNEL CHOCOLATE SPOT 
22737,RIBBON REEL CHRISTMAS PRESENT 
21125,SET 6 FOOTBALL CELEBRATION CANDLES
21169,YOU'RE CONFUSING ME METAL SIGN 
37464,
22872,NUMBER TILE COTTAGE GARDEN 4
20750,RED RETROSPOT MINI CASES
84821,DANISH ROSE DELUXE COASTER
20975,12 PENCILS SMALL TUBE RED RETROSPOT
21466,RED FLOWER CROCHET FOOD COVER
21340,CLASSIC METAL BIRDCAGE PLANT HOLDER
84882,GREEN WIRE STANDING CANDLE HOLDER
21461,BLUE EASTER EGG HUNT START POST
21500,PINK POLKADOT WRAP 
84755,COLOUR GLASS T-LIGHT HOLDER HANGING
21788,KIDS RAIN MAC BLUE
22878,NUMBER TILE COTTAGE GARDEN No
84596G,SMALL CHOCOLATES PINK BOWL
85170C,SET/6 EAU DE NIL BIRD T-LIGHTS
84800L,LARGE WHITE/PINK ROSE ART FLOWER
21917,SET 12 KIDS  WHITE CHALK STICKS
21506,"""FANCY FONT BIRTHDAY CARD"
84347,ROTATING SILVER ANGELS T-LIGHT HLDR
90165B,WHITE ROSEBUD  PEARL EARRINGS
90014A,SILVER/MOP ORBIT NECKLACE
22161,HEART DECORATION RUSTIC HANGING 
21988,PACK OF 6 SKULL PAPER PLATES
47579,TEA TIME BREAKFAST BASKET
21803,CHRISTMAS TREE STAR DECORATION
22965,3 TRADITIONAl BISCUIT CUTTERS  SET
22630,DOLLY GIRL LUNCH BOX
84711B,PINK OVAL SHAPE TRINKET BOX
84692,BOX OF 24 COCKTAIL PARASOLS
22270,HAPPY EASTER HANGING DECORATION
22734,amazon sales
21708,FOLDING UMBRELLA CREAM POLKADOT
22802,FAUX FUR CHOCOLATE THROW
85034B,3 WHITE CHOC MORRIS BOXED CANDLES
72132,COLUMBIAN CUBE CANDLE
22144,CHRISTMAS CRAFT LITTLE FRIENDS
21003,ROSE DU SUD CUSHION COVER
82494L,WOODEN FRAME ANTIQUE WHITE 
72802C,VANILLA SCENT CANDLE JEWELLED BOX
22599,CHRISTMAS MUSICAL ZINC STAR
20969,RED FLORAL FELTCRAFT SHOULDER BAG
85047,WHITE BEADED GARLAND STRING 20LIGHT
35914,PINK CHICK EGG WARMER + EGG CUP
22913,RED COAT RACK PARIS FASHION
85049G,CHOCOLATE BOX RIBBONS 
21688,SILVER PLATE CANDLE BOWL SMALL
21253,SET OF PICTURE FRAME  STICKERS
72351a,SET/6 TURQUOISE BUTTERFLY T-LIGHTS
84356,POMPOM CURTAIN
D,Discount
23231,WRAP DOILEY DESIGN
22547,MINI JIGSAW DINOSAUR 
90012B,BLACK DROP CRYSTAL NECKLACE
20931,BLUE POT PLANT CANDLE 
21928,JUMBO BAG SCANDINAVIAN PAISLEY
79321,CHILLI LIGHTS
90060B,FIRE POLISHED GLASS NECKL GOLD
77101A,UNION FLAG WINDSOCK
90185D,CRYSTAL DIAMANTE EXPANDABLE RING
21812,GARLAND WITH HEARTS AND BELLS
84536b,FAIRY CAKES NOTEBOOK A7 SIZE
90059F,DIAMANTE HAIR GRIP PACK/2 LT ROSE
21508,VINTAGE KID DOLLY CARD 
22794,SWEETHEART WIRE MAGAZINE RACK
21221,SET/4 BADGES CUTE CREATURES
20686,DOLLY MIXTURE CHILDREN'S UMBRELLA
22808,SET OF 6 T-LIGHTS EASTER CHICKS
21248,
90160D,PINK BOUDICCA LARGE BRACELET
40005B,BLUE ORGANDY ROUND LAMPSHADE W BEA
22344,PARTY PIZZA DISH PINK POLKADOT
15036,ASSORTED COLOURS SILK FAN
90184B,AMETHYST CHUNKY BEAD BRACELET W STR
22622,BOX OF VINTAGE ALPHABET BLOCKS
85032C,CURIOUS IMAGES GIFT WRAP SET
21972,SET OF 36 DINOSAUR PAPER DOILIES
22570,FELTCRAFT CUSHION RABBIT
90177C,DROP DIAMANTE EARRINGS CRYSTAL
90164B,WHITE  ROSEBUD PEARL BRACELET
22361,GLASS JAR DAISY FRESH COTTON WOOL
21775,DECORATIVE FLORE BATHROOM BOTTLE
46000R,POLYESTER FILLER PAD 45x30cm
21088,SET/6 FRUIT SALAD PAPER CUPS
47589,CONGRATULATIONS BUNTING
20705,MRS ROBOT SOFT TOY
21792,CLASSIC FRENCH STYLE BASKET GREEN 
21773,DECORATIVE ROSE BATHROOM BOTTLE
22472,TV DINNER TRAY DOLLY GIRL
21703,BAG 125g SWIRLY MARBLES
35965,
72817,SET OF 2 CHRISTMAS DECOUPAGE CANDLE
22967,SET 3 SONG BIRD PAPER EGGS ASSORTED
85124B,BLUE JUICY FRUIT PHOTO FRAME
M,Manual
90030C,BROWN KUKUI COCONUT SEED NECKLACE
21613,S/12 VANILLA  BOTANICAL T-LIGHTS
22026,BANQUET BIRTHDAY  CARD  
22095,LADS ONLY TISSUE BOX
84977,
90122B,JADE CRYSTAL+GLASS BRACELET
21535,RED RETROSPOT SMALL MILK JUG
90039A,FIRE POLISHED GLASS BRACELET RED
22735,RIBBON REEL SOCKS AND MITTENS
22924,FRIDGE MAGNETS LA VIE EN ROSE
21055,TOOL BOX SOFT TOY 
21624,VINTAGE UNION JACK DOORSTOP
85049e,SCANDINAVIAN REDS RIBBONS
90108,BLUE BLOSSOM HAIR CLIP
22208,WOOD STAMP SET THANK YOU
22832,BROCANTE SHELF WITH HOOKS
22274,FELTCRAFT DOLL EMILY
22920,HERB MARKER BASIL
85132C,CHARLIE AND LOLA FIGURES TINS
22884,NUMBER TILE VINTAGE FONT 5
47310M,"""SMALL POP BOX"
21355,TOAST ITS - I LOVE YOU 
85099B,JUMBO BAG RED RETROSPOT
22426,ENAMEL WASH BOWL CREAM
22243,5 HOOK HANGER RED MAGIC TOADSTOOL
21260,FIRST AID TIN
21313,GLASS HEART T-LIGHT HOLDER 
85160B,BLACK BIRD GARDEN DESIGN MUG
21417,COCKLE SHELL DISH
22406,MONEY BOX KINGS CHOICE DESIGN
22566,FELTCRAFT HAIRBAND PINK AND PURPLE
22224,WHITE LOVEBIRD LANTERN
90128B,BLUE LEAVES AND BEADS PHONE CHARM
21222,SET/4 BADGES BEETLES
84802A,WHITE ANEMONE ARTIFICIAL FLOWER
90057,DIAMANTE RING ASSORTED IN BOX.
85109,PINK BOUDOIR T-LIGHT HOLDER
21042,RED RETROSPOT APRON 
84596B,SMALL DOLLY MIX DESIGN ORANGE BOWL
22838,3 TIER CAKE TIN RED AND CREAM
20977,36 PENCILS TUBE WOODLAND
22124,SET OF 2 TEA TOWELS PING MICROWAVE
21279,VINTAGE KITCHEN PRINT FRUITS
35599B,BLACK CHRISTMAS TREE 120CM
90178B,PURPLE CHUNKY GLASS+BEAD NECKLACE
21239,PINK  POLKADOT CUP
85036A,GARDENIA 1 WICK MORRIS BOXED CANDLE
85088,CANDY SPOT HAND BAG
84801A,PINK HYDRANGEA ART FLOWER
22582,PACK OF 6 SWEETIE GIFT BOXES
22669,RED BABY BUNTING 
90001D,ANTIQUE OLIVE GREEN FLOWER EARRINGS
20681,PINK POLKADOT CHILDRENS UMBRELLA
22708,WRAP DOLLY GIRL
21275,?
22661,CHARLOTTE BAG DOLLY GIRL DESIGN
22691,DOORMAT WELCOME SUNRISE
22302,COFFEE MUG PEARS  DESIGN
21809,CHRISTMAS HANGING TREE WITH BELL
21911,GARDEN METAL SIGN 
21066,VINTAGE RED MUG
22862,LOVE HEART NAPKIN BOX 
21349,IVY HEART WREATH
21265,PINK GOOSE FEATHER TREE 60CM
22465,HANGING METAL STAR LANTERN
84638,SMALL KITCHEN FLOWER POTS PLAQUE
84809A,WHITE CHRYSANTHEMUMS ART FLOWER
71038,WHITE HANGING BEADS CANDLE HOLDER
21389,IVORY HANGING DECORATION  BIRD
21190,PINK HEARTS PAPER GARLAND
21380,WOODEN HAPPY BIRTHDAY GARLAND
21326,AGED GLASS SILVER T-LIGHT HOLDER
85019A,ROMANTIC IMAGES NOTEBOOK SET
16015,MEDIUM CHINESE STYLE SCISSOR
84872A,TEATIME FUNKY FLOWER BACKPACK FOR 2
21479,WHITE SKULL HOT WATER BOTTLE 
22439,6 ROCKET BALLOONS 
90164A,PINK ROSEBUD PEARL BRACELET
22798,ANTIQUE GLASS DRESSING TABLE POT
21154,RED RETROSPOT OVEN GLOVE 
22815,CARD PSYCHEDELIC APPLES
21715,GIRLS VINTAGE TIN SEASIDE BUCKET
17165D,ASS COL LARGE SAND FROG P'WEIGHT
35818P,"""ACRYLIC JEWEL ICICLE"
22158,3 HEARTS HANGING DECORATION RUSTIC
22135,MINI LADLE LOVE HEART PINK
22696,WICKER WREATH LARGE
46775D,SUNSET COLOUR CHUNKY KNITTED THROW
84915,HAND TOWEL PINK FLOWER AND DAISY
22248,DECORATION  PINK CHICK MAGIC GARDEN
90115,SUMMER BUTTERFLIES BAG CHARM
85017C,ENVELOPE 50 CURIOUS IMAGES
72131,COLUMBIAN CANDLE RECTANGLE
21459,YELLOW EASTER EGG HUNT START POST
20668,DISCO BALL CHRISTMAS DECORATION
82600,NO SINGING METAL SIGN
22332,SKULLS PARTY BAG + STICKER SET
22134,LADLE LOVE HEART RED 
90175D,TIGRIS EYE CHUNKY CHARM BRACELET
22625,RED KITCHEN SCALES
20662,FIRST CLASS HOLIDAY PURSE 
20713,JUMBO BAG OWLS
22358,KINGS CHOICE TEA CADDY 
84826,ASSTD DESIGN 3D PAPER STICKERS
17084R,ASSORTED INCENSE PACK
46776E,WOVEN CANDY CUSHION COVER 
20956,
22545,MINI JIGSAW BUNNIES
84313C,ORANGE TV TRAY TABLE 
22116,METAL SIGN HIS DINNER IS SERVED
22278,OVERNIGHT BAG VINTAGE ROSE PAISLEY
22962,JAM JAR WITH PINK LID
22818,CARD CHRISTMAS VILLAGE
90177E,DROP DIAMANTE EARRINGS GREEN
84997B,RED 3 PIECE RETROSPOT CUTLERY SET
22451,SILK PURSE BABUSHKA RED
22756,LARGE YELLOW BABUSHKA NOTEBOOK 
20933,YELLOW POT PLANT CANDLE
90096,
90081A,LILY BROOCH AMETHYST COLOUR
10135,COLOURING PENCILS BROWN TUBE
22939,APRON APPLE DELIGHT
84748,FOLK FELT HANGING MULTICOL GARLAND
21975,PACK OF 60 DINOSAUR CAKE CASES
17007B,S/3 POT POURI CUSHIONS BLUE COLOURS
20802,SMALL GLASS SUNDAE DISH CLEAR
85035c,ROSE 3 WICK MORRIS BOX CANDLE
79067,
21910,WAY OUT METAL SIGN 
22492,MINI PAINT SET VINTAGE 
20725,LUNCH BAG RED SPOTTY
20985,HEART CALCULATOR
20677,PINK POLKADOT BOWL
22968,ROSE COTTAGE KEEPSAKE BOX 
21465,PINK FLOWER CROCHET FOOD COVER
85089,CANDY SPOT BUNNY
22271,FELTCRAFT DOLL ROSIE
22059,CERAMIC STRAWBERRY DESIGN MUG
84706D,CHERRY BLOSSOM TABLE CLOCK 
84358,FLOOR LAMP SHADE WOOD BASE
22509,SEWING BOX RETROSPOT DESIGN 
84520B,PACK 20 ENGLISH ROSE PAPER NAPKINS
21071,VINTAGE BILLBOARD DRINK ME MUG
84678,CLASSICAL ROSE SMALL VASE
21324,
62086A,PINK RETRO BIG FLOWER BAG
21680,WOODLAND  STICKERS
90120D,WHITE MURANO TWIST BRACELET
22607,WOODEN ROUNDERS GARDEN SET 
22244,3 HOOK HANGER MAGIC GARDEN
72801D,4 SKY BLUE DINNER CANDLES
84659A,WHITE TRAVEL ALARM CLOCK
20754,RETROSPOT RED WASHING UP GLOVES
21643,ASSORTED TUTTI FRUTTI MIRROR
21391,FRENCH LAVENDER SCENT HEART
46000S,POLYESTER FILLER PAD 40x40cm
22318,FIVE HEART HANGING DECORATION
16238,PARTY TIME PENCIL ERASERS
22183,CAKE STAND VICTORIAN FILIGREE MED
20701,PINK CAT FLORAL CUSHION COVER 
20992,JAZZ HEARTS PURSE NOTEBOOK
22518,CHILDS GARDEN BRUSH BLUE
22822,CREAM WALL PLANTER HEART SHAPED
22734,amazon
85026B,EAU DE NILE JEWELLED T-LIGHT HOLDER
22699,ROSES REGENCY TEACUP AND SAUCER 
85107,CUT GLASS T-LIGHT HOLDER OCTAGON
22335,HEART DECORATION PAINTED ZINC 
82494l,WOODEN FRAME ANTIQUE WHITE 
35095B,RED VICTORIAN FABRIC OVAL BOX
22187,GREEN CHRISTMAS TREE CARD HOLDER
10124G,ARMY CAMO BOOKCOVER TAPE
84536B,FAIRY CAKES NOTEBOOK A7 SIZE
22896,PEG BAG APPLES DESIGN
90181A,AMBER GLASS/SHELL/PEARL NECKLACE
21874,GIN AND TONIC MUG
22096,PINK PAISLEY SQUARE TISSUE BOX 
84031A,CHARLIE+LOLA RED HOT WATER BOTTLE 
22072,RED RETROSPOT TEA CUP AND SAUCER 
84816,DANISH ROSE BEDSIDE CABINET
90027C,GLASS BEAD HOOP EARRINGS GREEN
21096,SET/6 FRUIT SALAD  PAPER PLATES
22959,
22473,TV DINNER TRAY VINTAGE PAISLEY
85124C,
21922,UNION STRIPE WITH FRINGE  HAMMOCK
22556,PLASTERS IN TIN CIRCUS PARADE 
22842,BISCUIT TIN VINTAGE RED
22948,METAL DECORATION NAUGHTY CHILDREN 
22262,FELT EGG COSY CHICKEN
22806,SET OF 6 T-LIGHTS WEDDING CAKE 
21316,SMALL CHUNKY GLASS ROMAN  BOWL
90040C,MURANO STYLE GLASS BRACELET GOLD
22711,WRAP CIRCUS PARADE
84535B,FAIRY CAKES NOTEBOOK A6 SIZE
22374,AIRLINE BAG VINTAGE JET SET RED
72351A,SET/6 TURQUOISE BUTTERFLY T-LIGHTS
84031B,CHARLIE LOLA BLUE HOT WATER BOTTLE 
22467,GUMBALL COAT RACK
47021G,SET/6 BEAD COASTERS GAUZE BAG GOLD
22784,LANTERN CREAM GAZEBO 
85027L,FRENCH CHATEAU LARGE PLATTER 
21774,DECORATIVE CATS BATHROOM BOTTLE
84665,SQUARE CHERRY BLOSSOM CABINET
85054,FRENCH ENAMEL POT W LID
84840,SWEETHEART CARRY-ALL BASKET
22733,3D TRADITIONAL CHRISTMAS STICKERS
82011C,BATHROOM SCALES FOOTPRINTS IN SAND
20616,CHERRY BLOSSOM PASSPORT COVER
22292,HANGING CHICK  YELLOW DECORATION
21161,
35923,CANDY HEART HANGING DECORATION
21621,VINTAGE UNION JACK BUNTING
22906,12 MESSAGE CARDS WITH ENVELOPES
21056,DOCTOR'S BAG SOFT TOY
84670,
22710,WRAP I LOVE LONDON 
22875,NUMBER TILE COTTAGE GARDEN 7
21679,SKULLS  STICKERS
21398,RED POLKADOT COFFEE  MUG
21686,MEDINA STAMPED METAL STOOL
AMAZONFEE,AMAZON FEE
85173,SET/6 FROG PRINCE T-LIGHT CANDLES
20854,BLUE PATCH PURSE PINK HEART
90141B,IVORY PENDANT TRIPLE SHELL NECKLACE
84030E,ENGLISH ROSE HOT WATER BOTTLE
21763,VINTAGE WOODEN BAR STOOL
90195B,BLACK GEMSTONE BRACELET
85114C,RED ENCHANTED FOREST PLACEMAT
84952C,
22616,PACK OF 12 LONDON TISSUES 
20654,FIRST CLASS LUGGAGE TAG 
21374,MIRRORED WALL ART SKULLS
21442,GREEN BIRDHOUSE DECORATION
22151,PLACE SETTING WHITE HEART
22837,
79191B,RETRO PLASTIC POLKA TRAY
21730,GLASS STAR FROSTED T-LIGHT HOLDER
22041,"""RECORD FRAME 7"""" SINGLE SIZE """
22037,ROBOT BIRTHDAY CARD
21670,BLUE SPOT CERAMIC DRAWER KNOB
21756,BATH BUILDING BLOCK WORD
20820,SILVER LOOKING MIRROR
22942,CHRISTMAS LIGHTS 10 SANTAS 
21758,VINTAGE SHELLS PRINT
21948,SET OF 6 CAKE CHOPSTICKS
18098c,PORCELAIN BUTTERFLY OIL BURNER
84415B,BLUE FLOCK CUSHION COVER 
21661,VINTAGE GLASS TEA CADDY
20966,SANDWICH BATH SPONGE
90214L,"""LETTER """"L"""" BLING KEY RING"""
84910A,PINK PAISLEY CUSHION COVER 
21094,SET/6 RED SPOTTY PAPER PLATES
85231B,CINAMMON SET OF 9 T-LIGHTS
21634,ASSORTED MINI MADRAS NOTEBOOK
22789,T-LIGHT HOLDER SWEETHEART HANGING
90070,RUBY GLASS CLUSTER BRACELET
84509A,SET OF 4 ENGLISH ROSE PLACEMATS
21467,CHERRY CROCHET FOOD COVER
21025,SPACE FROG
22963,JAM JAR WITH BLUE LID
21589,
72225C,LAVENDER SCENT CAKE CANDLE
22730,ALARM CLOCK BAKELIKE IVORY
22740,POLKADOT PEN
71495A,CD WALL TIDY BLUE OFFICE
85170B,SET/6 BLACK BIRD T-LIGHT CANDLES
85160a,WHITE BIRD GARDEN DESIGN MUG
90077,BLACK DIAMOND CLUSTER EARRINGS
21220,SET/4 BADGES DOGS
22320,BIRDS MOBILE VINTAGE DESIGN
82613D,METAL SIGN CUPCAKE SINGLE HOOK
21488,RED WHITE SCARF  HOT WATER BOTTLE
15060B,FAIRY CAKE DESIGN UMBRELLA
21195,PINK  HONEYCOMB PAPER BALL 
84673B,BLUE FLY SWAT
22252,BIRDCAGE DECORATION TEALIGHT HOLDER
22062,CERAMIC BOWL WITH LOVE HEART DESIGN
22839,3 TIER CAKE TIN GREEN AND CREAM
21364,PEACE SMALL WOOD LETTERS
21089,SET/6 GREEN SPRING PAPER CUPS
84580,MOUSE TOY WITH PINK T-SHIRT
22286,"""DECORATION "
21811,CHRISTMAS HANGING HEART WITH BELL
84510A,SET OF 4 ENGLISH ROSE COASTERS
22317,FIVE CATS HANGING DECORATION
85049a,TRADITIONAL CHRISTMAS RIBBONS
90160B,RED BOUDICCA LARGE BRACELET
84876B,GREEN HEART COMPACT MIRROR
90123C,GREEN HEART OF GLASS BRACELET
84819,DANISH ROSE ROUND SEWING BOX
22984,CARD GINGHAM ROSE 
20761,BLUE PAISLEY SKETCHBOOK
21625,VINTAGE UNION JACK APRON
22030,SWALLOWS GREETING CARD
90186A,AMETHYST HOOP EARRING FLORAL LEAF
90128D,PURPLE LEAVES AND BEADS PHONE CHAR
22750,FELTCRAFT PRINCESS LOLA DOLL
22589,CARDHOLDER GINGHAM STAR
21196,ROUND WHITE CONFETTI IN TUBE
47578A,ENGLISH ROSE SMALL SCENTED FLOWER
22973,CHILDREN'S CIRCUS PARADE MUG
22396,MAGNETS PACK OF 4 RETRO PHOTO
21357,
21823,PAINTED METAL HEART WITH HOLLY BELL
21992,VINTAGE PAISLEY STATIONERY SET
84968e,SET OF 16 VINTAGE BLACK CUTLERY
72122,COFFEE SCENT PILLAR CANDLE
22028,PENNY FARTHING BIRTHDAY CARD
85215,
21277,FRENCH STYLE EMBOSSED HEART CABINET
21620,SET OF 4 ROSE BOTANICAL CANDLES
22064,PINK DOUGHNUT TRINKET POT 
37464,ROBOT MUG IN DISPLAY BOX
22416,SET OF 36 DOILIES SPACEBOY DESIGN 
22114,
22861,EASTER TIN CHICKS IN GARDEN
21900,"""KEY FOB "
22896,PEG BAG APPLE DESIGN
C2,CARRIAGE
22753,SMALL YELLOW BABUSHKA NOTEBOOK 
22483,RED GINGHAM TEDDY BEAR 
84951A,SET OF 4 PISTACHIO LOVEBIRD COASTER
79191C,RETRO PLASTIC ELEPHANT TRAY
22831,WHITE BROCANTE SOAP DISH
90175C,BLUE GLASS CHUNKY CHARM BRACELET
21822,GLITTER CHRISTMAS TREE WITH BELLS
22941,CHRISTMAS LIGHTS 10 REINDEER
20760,GARDEN PATH POCKET BOOK
35653,VINTAGE BEAD NOTEBOOK
90024E,NEW BAROQUE B'FLY NECKLACE MONTANA
22934,BAKING MOULD EASTER EGG WHITE CHOC
21123,SET/10 IVORY POLKADOT PARTY CANDLES
84637,KITCHEN FLOWER POTS WALL PLAQUE
21790,VINTAGE SNAP CARDS
72801G,4 BURGUNDY WINE DINNER CANDLES
84247C,
84991,60 TEATIME FAIRY CAKE CASES
22195,LARGE HEART MEASURING SPOONS
22429,ENAMEL MEASURING JUG CREAM
16156S,WRAP PINK FAIRY CAKES 
21452,TOADSTOOL MONEY BOX
84558a,3D DOG PICTURE PLAYING CARDS
22414,DOORMAT NEIGHBOURHOOD WITCH 
21238,RED RETROSPOT CUP
90183A,AMBER DROP EARRINGS W LONG BEADS
21883,STARS GIFT TAPE 
90039D,FIRE POLISHED GLASS BRACELET GREEN
35924,HANGING FAIRY CAKE DECORATION
72802B,OCEAN SCENT CANDLE IN JEWELLED BOX
70006,LOVE HEART POCKET WARMER
22943,CHRISTMAS LIGHTS 10 VINTAGE BAUBLES
90103,PURPLE FRANGIPANI NECKLACE
22265,EASTER DECORATION NATURAL CHICK
22576,SWALLOW WOODEN CHRISTMAS DECORATION
90013C,GREEN VINTAGE EARRINGS 
22639,SET OF 4 NAPKIN CHARMS HEARTS
84970S,HANGING HEART ZINC T-LIGHT HOLDER
84660A,WHITE STITCHED WALL CLOCK
21060,PARTY INVITES BALLOON GIRL
21884,CAKES AND BOWS GIFT  TAPE
47591d,PINK FAIRY CAKE CHILDRENS APRON
84802A,
22923,FRIDGE MAGNETS LES ENFANTS ASSORTED
85116,BLACK CANDELABRA T-LIGHT HOLDER
22846,BREAD BIN DINER STYLE RED 
17012C,ORIGAMI LAVENDER INCENSE/CANDL SET 
84510a,SET OF 4 ENGLISH ROSE COASTERS
21794,CLASSIC FRENCH STYLE BASKET NATURAL
90128A,PINK LEAVES AND BEADS PHONE CHARM
22970,LONDON BUS COFFEE MUG
16161M,WRAP  PINK FLOCK
35819B,"""ACRYLIC HANGING JEWEL"
90067A,PINK VINTAGE VICTORIAN EARRINGS
22100,SKULLS SQUARE TISSUE BOX
90202D,PINK ENAMEL FLOWER HAIR TIE
16052,TEATIME PUSH DOWN RUBBER
22837,?
21814,HEART T-LIGHT HOLDER 
20971,PINK BLUE FELT CRAFT TRINKET BOX
21535,
22241,GARLAND WOODEN HAPPY EASTER
21002,ROSE DU SUD DRAWSTRING BAG
21382,SET/4 SPRING FLOWER DECORATION
85126,LARGE ROUND CUTGLASS CANDLESTICK
21667,
22275,WEEKEND BAG VINTAGE ROSE PAISLEY
85095,THREE CANVAS LUGGAGE TAGS
90146,FINE SILVER NECKLACE W PASTEL FLOWE
22963,JAM JAR WITH GREEN LID
10123C,HEARTS WRAPPING TAPE 
90214R,"""LETTER """"R"""" BLING KEY RING"""
22080,RIBBON REEL POLKADOTS 
20941,FROG CANDLE
22246,"""GARLAND"
21595,
gift_0001_40,Dotcomgiftshop Gift Voucher £40.00
72807C,SET/3 VANILLA SCENTED CANDLE IN BOX
22400,MAGNETS PACK OF 4 HOME SWEET HOME
20718,RED RETROSPOT SHOPPER BAG
84792,ENCHANTED BIRD COATHANGER 5 HOOK
72814,
22045,SPACEBOY GIFT WRAP
20703,BLUE PADDED SOFT MOBILE
21879,HEARTS GIFT TAPE
21622,VINTAGE UNION JACK CUSHION COVER
21269,ANTIQUE CREAM CUTLERY SHELF 
21421,
23232,WRAP VINTAGE PETALS  DESIGN
21817,GLITTER CHRISTMAS TREE
16169N,WRAP BLUE RUSSIAN FOLKART
90184A,AMBER CHUNKY BEAD BRACELET W STRAP
90201B,BLACK ENAMEL FLOWER RING
22055,MINI CAKE STAND  HANGING STRAWBERY
85049B,LUSH GREENS RIBBONS
22211,WOOD STAMP SET FLOWERS
85039A,SET/4 RED MINI ROSE CANDLE IN BOWL
35953,FOLKART STAR CHRISTMAS DECORATIONS
85035a,GARDENIA 3 WICK MORRIS BOXED CANDLE
22728,ALARM CLOCK BAKELIKE PINK
21547,CERAMIC BIRDHOUSE CRESTED TIT SMALL
22135,LADLE LOVE HEART PINK
22217,T-LIGHT HOLDER HANGING LACE
90059D,DIAMANTE HAIR GRIP PACK/2 PERIDOT
22949,36 DOILIES DOLLY GIRL
22464,HANGING METAL HEART LANTERN
85159B,"""WHITE TEA"
21875,KINGS CHOICE MUG
85123a,WHITE HANGING HEART T-LIGHT HOLDER
47504H,ENGLISH ROSE SPIRIT LEVEL 
71477,
21027,
22162,HEART GARLAND RUSTIC PADDED
22953,BIRTHDAY PARTY CORDON BARRIER TAPE
22263,FELT EGG COSY LADYBIRD 
21331,MOROCCAN BEATEN METAL DISH LARGE
21878,PACK OF 6 SANDCASTLE FLAGS ASSORTED
22032,BOTANICAL LILY GREETING CARD
35004P,SET OF 3 PINK FLYING DUCKS
90175B,PINK GLASS CHUNKY CHARM BRACELET
17012B,ORIGAMI JASMINE INCENSE/CANDLE SET
84030e,ENGLISH ROSE HOT WATER BOTTLE
